developer-experience,StevenBarre,true,2020-04-24T22:17:18Z,2020-04-24T21:27:32Z,,CLOSED,"Untangle NetApp Prod VM procurement and inventory",2020-04-24T22:17:19Z
developer-experience,StevenBarre,true,2020-04-28T18:29:28Z,2020-04-24T21:27:34Z,,CLOSED,"Create issues in GitHub for change control process",2020-04-28T18:29:28Z
developer-experience,StevenBarre,true,2020-07-30T20:17:21Z,2020-04-24T21:27:35Z,,CLOSED,"Playbook to automate OS patching",2020-07-30T20:17:21Z
developer-experience,StevenBarre,true,2020-05-29T23:00:45Z,2020-04-24T21:27:37Z,,CLOSED,"Add Nagios Freshness checking to OCP Monitor cron",2020-05-29T23:00:46Z
developer-experience,StevenBarre,true,2020-09-24T21:43:13Z,2020-04-24T21:27:38Z,2020-09-24T21:38:55Z,CLOSED,"HAProxy TLS Setup",2020-09-24T21:43:13Z
developer-experience,StevenBarre,true,2020-04-28T15:36:33Z,2020-04-24T21:27:39Z,,CLOSED,"Review iSCSI settings for NetApp",2020-04-28T15:36:33Z
developer-experience,StevenBarre,true,2020-10-07T15:18:47Z,2020-04-24T21:27:41Z,2020-05-01T17:37:32Z,CLOSED,"INC0032789 Sysdig agents disconnecting",2020-10-07T15:18:47Z
developer-experience,StevenBarre,true,2020-04-24T22:22:44Z,2020-04-24T21:27:42Z,,CLOSED,"HAProxy Performance Tuning",2020-04-24T22:22:44Z
developer-experience,StevenBarre,true,2020-07-30T20:14:22Z,2020-04-24T21:27:43Z,2020-05-01T17:36:05Z,CLOSED,"Sysdig dashboard issues",2020-07-30T20:14:22Z
developer-experience,StevenBarre,true,2020-07-30T20:07:20Z,2020-04-24T21:27:45Z,,CLOSED,"Remove router custom ciphers",2020-07-30T20:07:20Z
developer-experience,StevenBarre,true,2020-04-28T16:55:17Z,2020-04-24T21:27:47Z,,CLOSED,"NFS PV implementation for backup storage targets",2020-04-28T16:55:17Z
developer-experience,StevenBarre,true,2020-08-25T16:46:08Z,2020-04-24T21:27:48Z,,CLOSED,"PRB0040321 Block Hosting Volumes fill up with extra files",2020-08-25T16:46:08Z
developer-experience,StevenBarre,true,2020-05-28T20:49:44Z,2020-04-24T21:27:50Z,,CLOSED,"Gluster brick process crashes on portscan",2020-05-28T20:49:45Z
developer-experience,StevenBarre,true,2020-04-28T15:37:35Z,2020-04-24T21:27:51Z,,CLOSED,"INC0029871 ociopf-p-186 /var/lib/origin full",2020-04-28T15:37:35Z
developer-experience,StevenBarre,true,2020-04-24T21:31:52Z,2020-04-24T21:27:52Z,,CLOSED,"Decommission Subnet",2020-04-24T21:31:52Z
developer-experience,StevenBarre,true,2020-04-24T21:31:53Z,2020-04-24T21:27:54Z,,CLOSED,"Create cluster view access for a service account",2020-04-24T21:31:53Z
developer-experience,StevenBarre,true,2020-04-24T21:31:36Z,2020-04-24T21:27:55Z,,CLOSED,"NetApp Production Rollout",2020-04-24T21:31:36Z
developer-experience,StevenBarre,true,2020-04-24T21:31:36Z,2020-04-24T21:27:57Z,,CLOSED,"Sysdig support recommendations on agent resources",2020-04-24T21:31:36Z
developer-experience,StevenBarre,true,2020-04-24T21:31:36Z,2020-04-24T21:27:58Z,,CLOSED,"Transfer ownership of subnets",2020-04-24T21:31:36Z
developer-experience,StevenBarre,true,2020-04-24T21:31:37Z,2020-04-24T21:27:59Z,,CLOSED,"Re-Balance CNS Gluster blocks across all 4 nodes",2020-04-24T21:31:37Z
developer-experience,StevenBarre,true,2020-04-24T21:31:37Z,2020-04-24T21:28:01Z,,CLOSED,"Add ONTAP Select cluster to PROD for additional storage",2020-04-24T21:31:37Z
developer-experience,StevenBarre,true,2020-04-24T21:31:37Z,2020-04-24T21:28:03Z,,CLOSED,"Investigate alternative storage options",2020-04-24T21:31:37Z
developer-experience,StevenBarre,true,2020-04-24T21:31:37Z,2020-04-24T21:28:04Z,,CLOSED,"INC0029716 ociopf-p-212 HBA issues",2020-04-24T21:31:37Z
developer-experience,StevenBarre,true,2020-04-24T21:31:37Z,2020-04-24T21:28:06Z,,CLOSED,"Investigate NFS APB issues in Lab",2020-04-24T21:31:37Z
developer-experience,StevenBarre,true,2020-04-24T21:31:38Z,2020-04-24T21:28:07Z,,CLOSED,"NetApp Test Plans for Lab",2020-04-24T21:31:38Z
developer-experience,StevenBarre,true,2020-04-24T21:31:38Z,2020-04-24T21:28:09Z,,CLOSED,"etd metrics enabled for Sysdig",2020-04-24T21:31:38Z
developer-experience,StevenBarre,true,2020-04-24T21:31:38Z,2020-04-24T21:28:10Z,,CLOSED,"Enable unsafe sysctl (to allow per pod disable of IPv6)",2020-04-24T21:31:38Z
developer-experience,StevenBarre,true,2020-04-24T21:31:38Z,2020-04-24T21:28:11Z,,CLOSED,"Cancel backups for the LAB",2020-04-24T21:31:38Z
developer-experience,StevenBarre,true,2020-04-24T21:31:39Z,2020-04-24T21:28:13Z,,CLOSED,"Sysdig Support Case",2020-04-24T21:31:39Z
developer-experience,StevenBarre,true,2020-04-24T21:31:39Z,2020-04-24T21:28:14Z,,CLOSED,"Test CNS Volume Expansion in LAB",2020-04-24T21:31:39Z
developer-experience,StevenBarre,true,2020-04-24T21:31:39Z,2020-04-24T21:28:16Z,,CLOSED,"Addressing critical security issue CVE-2018-1002105 for OCP environments",2020-04-24T21:31:39Z
developer-experience,StevenBarre,true,2020-04-24T21:31:39Z,2020-04-24T21:28:17Z,,CLOSED,"Update pathfinder wildcard cert in cluster",2020-04-24T21:31:39Z
developer-experience,StevenBarre,true,2020-04-24T21:31:40Z,2020-04-24T21:28:19Z,,CLOSED,"AppNodes: Docker image cache cleanup cron",2020-04-24T21:31:40Z
developer-experience,StevenBarre,true,2020-04-24T21:31:40Z,2020-04-24T21:28:20Z,,CLOSED,"Sysdig Monitor POC (Basic Setup)",2020-04-24T21:31:40Z
developer-experience,StevenBarre,true,2020-04-24T21:31:40Z,2020-04-24T21:28:21Z,,CLOSED,"Setup adhoc monitoring for /var/lib/docker on all Openshift nodes",2020-04-24T21:31:40Z
developer-experience,StevenBarre,true,2020-04-24T21:31:40Z,2020-04-24T21:28:22Z,,CLOSED,"Project object backups",2020-04-24T21:31:40Z
developer-experience,StevenBarre,true,2020-04-24T21:31:41Z,2020-04-24T21:28:24Z,,CLOSED,"Remove DashAI from LAB",2020-04-24T21:31:41Z
developer-experience,StevenBarre,true,2020-04-24T21:31:41Z,2020-04-24T21:28:25Z,,CLOSED,"Remove DashAI from PROD",2020-04-24T21:31:41Z
developer-experience,StevenBarre,true,2020-04-24T21:31:41Z,2020-04-24T21:28:26Z,,CLOSED,"Deploy Registry Pruning cronjobs",2020-04-24T21:31:41Z
developer-experience,StevenBarre,true,2020-04-24T21:31:41Z,2020-04-24T21:28:28Z,,CLOSED,"Create an AdvSol test account for OCP",2020-04-24T21:31:41Z
developer-experience,StevenBarre,true,2020-04-24T21:31:41Z,2020-04-24T21:28:29Z,,CLOSED,"Leverage pre/post ansible hooks for custom work during OCP upgrades",2020-04-24T21:31:41Z
developer-experience,StevenBarre,true,2020-04-24T21:31:16Z,2020-04-24T21:28:31Z,,CLOSED,"Create GitHub test account(s) for pathfinder access",2020-04-24T21:31:16Z
developer-experience,StevenBarre,true,2020-04-24T21:31:16Z,2020-04-24T21:28:32Z,,CLOSED,"Migrate to Rocket.Chat",2020-04-24T21:31:16Z
developer-experience,StevenBarre,true,2020-04-24T21:31:16Z,2020-04-24T21:28:34Z,,CLOSED,"Install Dashai in platform PROD",2020-04-24T21:31:16Z
developer-experience,StevenBarre,true,2020-04-24T21:31:16Z,2020-04-24T21:28:35Z,,CLOSED,"Deploy and Configure Dashai in LAB",2020-04-24T21:31:16Z
developer-experience,StevenBarre,true,2020-04-24T21:32:37Z,2020-04-24T21:28:36Z,,CLOSED,"Configure/Evaluate 3.11 Prometheus Monitoring/Alerting",2020-04-24T21:32:37Z
developer-experience,StevenBarre,true,2020-04-24T21:31:17Z,2020-04-24T21:28:37Z,,CLOSED,"Review targets that aren't being polled in the lab for dashai.",2020-04-24T21:31:17Z
developer-experience,StevenBarre,true,2020-04-24T21:31:17Z,2020-04-24T21:28:39Z,,CLOSED,"Disk space consumption involving /var/lib/docker",2020-04-24T21:31:17Z
developer-experience,StevenBarre,true,2020-04-24T21:31:17Z,2020-04-24T21:28:40Z,,CLOSED,"Upgrade to OCP 3.11",2020-04-24T21:31:17Z
developer-experience,StevenBarre,true,2020-04-24T21:31:17Z,2020-04-24T21:28:41Z,,CLOSED,"Test bcdevops-admin role label permissions",2020-04-24T21:31:17Z
developer-experience,StevenBarre,true,2020-04-24T21:31:17Z,2020-04-24T21:28:43Z,,CLOSED,"Annotate all projects",2020-04-24T21:31:18Z
developer-experience,StevenBarre,true,2020-04-24T21:31:18Z,2020-04-24T21:28:44Z,,CLOSED,"Review how we manage quotas",2020-04-24T21:31:18Z
developer-experience,StevenBarre,true,2020-04-24T21:31:18Z,2020-04-24T21:28:45Z,,CLOSED,"Clean up Red Hat support Cases",2020-04-24T21:31:18Z
developer-experience,StevenBarre,true,2020-04-24T21:31:18Z,2020-04-24T21:28:47Z,,CLOSED,"Document Audit Log setup and config",2020-04-24T21:31:18Z
developer-experience,StevenBarre,true,2020-04-24T21:31:18Z,2020-04-24T21:28:48Z,,CLOSED,"Logging-curator pod in logging project crashloops after 3.11 OCP upgrade",2020-04-24T21:31:18Z
developer-experience,StevenBarre,true,2020-04-24T21:31:19Z,2020-04-24T21:28:49Z,,CLOSED,"Explore moving gluster volume health checks from serial to parallel process",2020-04-24T21:31:19Z
developer-experience,StevenBarre,true,2020-04-24T21:31:19Z,2020-04-24T21:28:51Z,,CLOSED,"Discussion around timing and execution for PROD OCS/CNS upgrade to 3.11.1",2020-04-24T21:31:19Z
developer-experience,StevenBarre,true,2020-04-24T21:31:19Z,2020-04-24T21:28:52Z,,CLOSED,"Review actual cluster / host utilization",2020-04-24T21:31:19Z
developer-experience,StevenBarre,true,2020-04-24T21:31:19Z,2020-04-24T21:28:54Z,,CLOSED,"Secure the Docker Registry in PROD",2020-04-24T21:31:19Z
developer-experience,StevenBarre,true,2020-04-24T21:31:19Z,2020-04-24T21:28:55Z,,CLOSED,"Upgrade to CNS/OCS 3.11.1",2020-04-24T21:31:19Z
developer-experience,StevenBarre,true,2020-04-24T21:31:20Z,2020-04-24T21:28:56Z,,CLOSED,"Enable Pulp Repositories as a cluster upgrade source",2020-04-24T21:31:20Z
developer-experience,StevenBarre,true,2020-04-24T21:31:20Z,2020-04-24T21:28:57Z,,CLOSED,"Investigate F5 Global Load Balancing",2020-04-24T21:31:20Z
developer-experience,StevenBarre,true,2020-04-24T21:31:20Z,2020-04-24T21:28:59Z,,CLOSED,"Grafana in Prod everyone can all projects",2020-04-24T21:31:20Z
developer-experience,StevenBarre,true,2020-04-24T21:31:20Z,2020-04-24T21:29:00Z,,CLOSED,"Slow DNS from PODs",2020-04-24T21:31:20Z
developer-experience,StevenBarre,true,2020-04-24T21:31:21Z,2020-04-24T21:29:02Z,,CLOSED,"2019 Q1 OS Patching",2020-04-24T21:31:21Z
developer-experience,StevenBarre,true,2020-04-24T21:31:21Z,2020-04-24T21:29:03Z,,CLOSED,"Switch /var/lib/origin to XFS",2020-04-24T21:31:21Z
developer-experience,StevenBarre,true,2020-04-24T21:31:21Z,2020-04-24T21:29:05Z,,CLOSED,"CNS orphan cleanup",2020-04-24T21:31:21Z
developer-experience,StevenBarre,true,2020-04-24T21:31:01Z,2020-04-24T21:29:06Z,,CLOSED,"Kibana post-3.11 is not allowing some users to authenticate",2020-04-24T21:31:01Z
developer-experience,StevenBarre,true,2020-04-24T21:31:01Z,2020-04-24T21:29:07Z,,CLOSED,"Forecast 2019 - Q1",2020-04-24T21:31:01Z
developer-experience,StevenBarre,true,2020-04-24T21:31:01Z,2020-04-24T21:29:09Z,,CLOSED,"Re-design playbook for grabbing evacuated pods due to NodeNotReady or similar",2020-04-24T21:31:01Z
developer-experience,StevenBarre,true,2020-04-24T21:31:01Z,2020-04-24T21:29:10Z,,CLOSED,"Add capacity to track KILL signal requests to auditd on all clusters",2020-04-24T21:31:01Z
developer-experience,StevenBarre,true,2020-04-24T21:31:02Z,2020-04-24T21:29:11Z,,CLOSED,"Install SSDs into CNS nodes",2020-04-24T21:31:02Z
developer-experience,StevenBarre,true,2020-04-24T21:31:02Z,2020-04-24T21:29:13Z,,CLOSED,"Request more RAM (iStore)",2020-04-24T21:31:02Z
developer-experience,StevenBarre,true,2020-04-24T21:31:02Z,2020-04-24T21:29:14Z,,CLOSED,"iStore to cancel storage",2020-04-24T21:31:02Z
developer-experience,StevenBarre,true,2020-04-24T21:31:02Z,2020-04-24T21:29:16Z,,CLOSED,"Update Docker PID limits",2020-04-24T21:31:02Z
developer-experience,StevenBarre,true,2020-04-24T21:31:02Z,2020-04-24T21:29:17Z,,CLOSED,"Execute OS patching for 2019 Q2",2020-04-24T21:31:02Z
developer-experience,StevenBarre,true,2020-04-24T21:31:03Z,2020-04-24T21:29:19Z,,CLOSED,"Plan for CHG0011897 Firewll replacement",2020-04-24T21:31:03Z
developer-experience,StevenBarre,true,2020-04-24T21:31:03Z,2020-04-24T21:29:20Z,,CLOSED,"Investigate why ociopf-p-192.dmz is slow",2020-04-24T21:31:03Z
developer-experience,StevenBarre,true,2020-04-24T21:31:03Z,2020-04-24T21:29:22Z,,CLOSED,"Figure out a better way to simulate workload in LAB",2020-04-24T21:31:03Z
developer-experience,StevenBarre,true,2020-04-24T21:31:03Z,2020-04-24T21:29:23Z,,CLOSED,"Change Heketi URL",2020-04-24T21:31:03Z
developer-experience,StevenBarre,true,2020-04-24T21:31:04Z,2020-04-24T21:29:25Z,,CLOSED,"Review/Confirm EmptyDir project/node quota",2020-04-24T21:31:04Z
developer-experience,StevenBarre,true,2020-04-24T21:31:04Z,2020-04-24T21:29:26Z,,CLOSED,"Increase vm.max_map_count for ElasticSearch",2020-04-24T21:31:04Z
developer-experience,StevenBarre,true,2020-04-24T21:31:04Z,2020-04-24T21:29:27Z,,CLOSED,"RHEL 8.0",2020-04-24T21:31:04Z
developer-experience,StevenBarre,true,2020-04-24T21:31:04Z,2020-04-24T21:29:28Z,,CLOSED,"Proactive check for API limits in cluster - usage versus configured limits",2020-04-24T21:31:04Z
developer-experience,StevenBarre,true,2020-04-24T21:31:05Z,2020-04-24T21:29:30Z,,CLOSED,"Disable 'delete project namespace' button for project admins",2020-04-24T21:31:05Z
developer-experience,StevenBarre,true,2020-04-24T21:31:05Z,2020-04-24T21:29:31Z,,CLOSED,"Debug Karim's issue with slow DNS",2020-04-24T21:31:05Z
developer-experience,StevenBarre,true,2020-04-24T21:31:05Z,2020-04-24T21:29:33Z,,CLOSED,"Forecast 2019 - Q2",2020-04-24T21:31:05Z
developer-experience,StevenBarre,true,2020-04-24T21:31:05Z,2020-04-24T21:29:34Z,,CLOSED,"TLS Cert for *.lab.pathfinder.gov.bc.ca expires July 27th",2020-04-24T21:31:05Z
developer-experience,StevenBarre,true,2020-04-24T21:31:05Z,2020-04-24T21:29:36Z,,CLOSED,"Investigate node kublet api rate tweaks",2020-04-24T21:31:05Z
developer-experience,StevenBarre,true,2020-04-24T21:31:06Z,2020-04-24T21:29:37Z,,CLOSED,"Tweak node kubelet settings from default for improved performance",2020-04-24T21:31:06Z
developer-experience,StevenBarre,true,2020-04-24T21:31:06Z,2020-04-24T21:29:38Z,,CLOSED,"Order additional storage for EFK",2020-04-24T21:31:06Z
developer-experience,StevenBarre,true,2020-04-24T21:31:06Z,2020-04-24T21:29:40Z,,CLOSED,"Cron to check for broken PV/PVCs",2020-04-24T21:31:06Z
developer-experience,StevenBarre,true,2020-04-24T21:30:40Z,2020-04-24T21:29:41Z,,CLOSED,"Investigate better API iptables rules",2020-04-24T21:30:40Z
developer-experience,StevenBarre,true,2020-04-24T21:30:40Z,2020-04-24T21:29:42Z,,CLOSED,"Ensure all PROD hosts have 24x7 uplift",2020-04-24T21:30:40Z
developer-experience,StevenBarre,true,2020-04-24T21:30:41Z,2020-04-24T21:29:44Z,,CLOSED,"RH CoreOS Deploy Steps",2020-04-24T21:30:41Z
developer-experience,StevenBarre,true,2020-04-24T21:30:41Z,2020-04-24T21:29:45Z,,CLOSED,"Migration from gluster classic to CNS",2020-04-24T21:30:41Z
developer-experience,StevenBarre,true,2020-04-24T21:30:41Z,2020-04-24T21:29:46Z,,CLOSED,"2019 Q3 OS patching",2020-04-24T21:30:41Z
developer-experience,StevenBarre,true,2020-04-24T21:30:42Z,2020-04-24T21:29:48Z,,CLOSED,"Enable Parallel docker image pulls",2020-04-24T21:30:42Z
developer-experience,StevenBarre,true,2020-04-24T21:30:42Z,2020-04-24T21:29:49Z,,CLOSED,"OCS Upgrade",2020-04-24T21:30:42Z
developer-experience,StevenBarre,true,2020-04-24T21:30:42Z,2020-04-24T21:29:50Z,,CLOSED,"OCP Upgrade",2020-04-24T21:30:42Z
developer-experience,StevenBarre,true,2020-04-24T21:30:43Z,2020-04-24T21:29:51Z,,CLOSED,"2019 Q3 OCS upgrade",2020-04-24T21:30:43Z
developer-experience,StevenBarre,true,2020-04-24T21:30:43Z,2020-04-24T21:29:53Z,,CLOSED,"Grow internal registry",2020-04-24T21:30:43Z
developer-experience,StevenBarre,true,2020-04-24T21:30:43Z,2020-04-24T21:29:54Z,,CLOSED,"Improve audit logs",2020-04-24T21:30:43Z
developer-experience,StevenBarre,true,2020-04-24T21:30:44Z,2020-04-24T21:29:56Z,,CLOSED,"Initial 100GB for PROD 3.11 Prometheus not sufficient",2020-04-24T21:30:44Z
developer-experience,StevenBarre,true,2020-04-24T21:30:44Z,2020-04-24T21:29:58Z,,CLOSED,"Cancel storage for App nodes",2020-04-24T21:30:44Z
developer-experience,StevenBarre,true,2020-04-24T21:30:44Z,2020-04-24T21:29:59Z,,CLOSED,"Forecast Q3 2019",2020-04-24T21:30:44Z
developer-experience,StevenBarre,true,2020-04-24T21:30:44Z,2020-04-24T21:30:00Z,,CLOSED,"Add 12 nodes to cluster",2020-04-24T21:30:44Z
developer-experience,StevenBarre,true,2020-04-24T21:30:45Z,2020-04-24T21:30:02Z,,CLOSED,"OCP 4.1 PoC",2020-04-24T21:30:45Z
developer-experience,StevenBarre,true,2020-04-24T21:30:45Z,2020-04-24T21:30:03Z,,CLOSED,"Add extended brick support to gluster health check",2020-04-24T21:30:45Z
developer-experience,StevenBarre,true,2020-04-24T21:30:45Z,2020-04-24T21:30:05Z,,CLOSED,"NFS-Backup APB Provisioning network security policy fixes",2020-04-24T21:30:45Z
developer-experience,StevenBarre,true,2020-04-24T21:30:45Z,2020-04-24T21:30:06Z,,CLOSED,"Forecast Q4 2019",2020-04-24T21:30:45Z
developer-experience,StevenBarre,true,2020-04-24T21:30:45Z,2020-04-24T21:30:08Z,,CLOSED,"pathfinder.gov.bc.ca TLS expiring Jan 31, 2020",2020-04-24T21:30:45Z
developer-experience,StevenBarre,true,2020-04-24T21:30:46Z,2020-04-24T21:30:09Z,,CLOSED,"Monitor for registry stuck in read only mode",2020-04-24T21:30:46Z
developer-experience,StevenBarre,true,2020-04-24T21:30:46Z,2020-04-24T21:30:11Z,,CLOSED,"INC0029750 ociopf-p-183 predictive hard drive failure",2020-04-24T21:30:46Z
developer-experience,StevenBarre,true,2020-04-24T21:30:46Z,2020-04-24T21:30:12Z,,CLOSED,"Internal certs for Elasticsearch per EFK Logging and their expiry",2020-04-24T21:30:46Z
developer-experience,StevenBarre,true,2020-04-24T21:30:46Z,2020-04-24T21:30:14Z,,CLOSED,"WARN: Low Metrics Cassandra Space - 15% free",2020-04-24T21:30:46Z
developer-experience,StevenBarre,true,2020-04-24T21:30:46Z,2020-04-24T21:30:15Z,,CLOSED,"Review how ocp-monitor tracks registry pods and their status",2020-04-24T21:30:46Z
developer-experience,ShellyXueHan,false,,2020-04-27T22:26:43Z,,OPEN,"Investigate in how to self-fix Documize issue",2020-08-05T18:45:47Z
developer-experience,mitovskaol,false,,2020-04-28T22:03:21Z,,OPEN,"Add BCDevExchange Logo and Banner to the new Status Page",2020-04-28T22:03:22Z
developer-experience,jefkel,true,2020-05-28T20:35:17Z,2020-04-29T00:39:21Z,,CLOSED,"Access request for Paul Fischer (Arctiq)",2020-05-28T20:35:17Z
developer-experience,StevenBarre,true,2020-06-04T22:13:48Z,2020-04-29T16:09:28Z,,CLOSED,"LAB TLS cert expiring",2020-07-02T19:04:26Z
developer-experience,NickCorcoran,false,,2020-04-29T17:58:56Z,,OPEN,"STRA for DevHub",2020-05-05T18:31:15Z
developer-experience,wmhutchison,true,2020-06-18T20:11:19Z,2020-04-29T21:22:01Z,,CLOSED,"PRB0040369 - OpenShift NetApp Block volumes fail to format and mount sometimes",2020-06-18T20:11:19Z
developer-experience,wmhutchison,true,2020-05-07T16:13:57Z,2020-04-29T21:36:48Z,,CLOSED,"RITM0061226 - Add resource reservations on all OCP3 PROD nodes",2020-05-07T16:13:57Z
developer-experience,wmhutchison,true,2020-05-01T22:43:19Z,2020-05-01T19:18:47Z,,CLOSED,"INC0035485 - SAN storage degraded on two APP nodes",2020-05-01T22:43:19Z
developer-experience,wmhutchison,true,2020-06-03T17:09:31Z,2020-05-01T23:03:09Z,,CLOSED,"RITM0062136 - New monitoring for multipath paths on system SAN storage",2020-06-03T17:09:31Z
developer-experience,ShellyXueHan,true,2020-05-19T20:58:58Z,2020-05-04T16:24:21Z,,CLOSED,"Figure out ownership of some programs and accounts",2020-05-19T20:58:59Z
developer-experience,StevenBarre,true,2020-05-27T16:04:56Z,2020-05-04T23:40:45Z,,CLOSED,"INC0035046 Metrics pods failing",2020-05-27T16:04:56Z
developer-experience,NickCorcoran,true,2020-06-03T18:10:04Z,2020-05-05T16:02:17Z,,CLOSED,"Wildcard cert for OIDC",2020-07-09T21:07:20Z
developer-experience,wmhutchison,true,2020-05-07T16:15:13Z,2020-05-05T16:39:13Z,,CLOSED,"INC0035609 - PROD MCS - One of three INFRA nodes is in a NotReady state",2020-05-07T16:15:13Z
developer-experience,ShellyXueHan,true,2020-07-08T17:19:06Z,2020-05-05T21:08:10Z,,CLOSED,"SSO - BCeID accounts with missing e-mail",2020-07-08T17:19:27Z
developer-experience,ShellyXueHan,false,,2020-05-05T21:09:58Z,,OPEN,"SSO - split BCeID flavour to individual agent realms - 1",2020-07-06T23:53:53Z
developer-experience,StevenBarre,true,2020-05-22T19:34:08Z,2020-05-07T16:40:33Z,,CLOSED,"Update Grafana graphs to account for node reservations",2020-05-22T19:34:09Z
developer-experience,StevenBarre,true,2020-06-25T20:59:12Z,2020-05-07T21:43:48Z,,CLOSED,"Review OpenShift master and node journal logs for errors",2020-06-25T20:59:12Z
developer-experience,StevenBarre,true,2020-06-15T19:58:56Z,2020-05-07T21:49:00Z,,CLOSED,"Reconcile OpenShift cluster roles and role bindings",2020-06-15T19:58:57Z
developer-experience,StevenBarre,true,2020-07-23T20:13:19Z,2020-05-07T22:10:34Z,,CLOSED,"Consider Guaranteed resources to infra projects",2020-07-23T20:13:19Z
developer-experience,tbaker1313,true,2020-07-07T23:10:01Z,2020-05-11T17:11:45Z,2020-06-04T22:30:56Z,CLOSED,"2020 Q2 Patching schedule",2020-07-07T23:10:01Z
developer-experience,NickCorcoran,true,2020-05-12T16:43:49Z,2020-05-12T15:12:26Z,,CLOSED,"Platform update to NRM Architecture team",2020-05-12T16:43:49Z
developer-experience,StevenBarre,true,2020-05-20T17:48:35Z,2020-05-12T19:23:29Z,,CLOSED,"Write up about container QoS",2020-05-20T17:48:35Z
developer-experience,ShellyXueHan,true,2020-06-17T16:30:06Z,2020-05-13T20:19:55Z,2020-06-17T16:30:03Z,CLOSED,"Manage private GitHub Org Resources",2020-06-17T16:30:06Z
developer-experience,stewartshea,true,2020-08-08T19:11:29Z,2020-05-15T16:33:48Z,2020-08-05T18:36:36Z,CLOSED,"Jenkins Optimization",2020-08-08T19:11:29Z
developer-experience,StevenBarre,true,2020-06-02T18:50:07Z,2020-05-19T23:15:42Z,,CLOSED,"PRB0040393 NodeNotReady",2020-06-02T18:50:07Z
developer-experience,NickCorcoran,true,2020-05-22T17:42:50Z,2020-05-22T17:42:42Z,2020-05-22T17:43:17Z,CLOSED,"OpenShift and You! (...and me) with Social Sector",2020-05-22T17:43:17Z
developer-experience,wmhutchison,true,2020-06-29T19:15:49Z,2020-05-26T16:35:55Z,,CLOSED,"OCP 3.11 PROD master certs due to expire July 2020",2020-06-29T19:15:49Z
developer-experience,wmhutchison,true,2020-05-28T19:43:11Z,2020-05-27T16:49:51Z,,CLOSED,"RITM0063688 - Update ocp-node-requisites role to perform overlay2 config on new node builds",2020-05-28T19:43:11Z
developer-experience,StevenBarre,true,2020-07-02T20:18:43Z,2020-05-27T16:50:32Z,2020-05-27T17:05:49Z,CLOSED,"Document change management process",2020-07-02T20:18:43Z
developer-experience,ShellyXueHan,true,2020-08-05T18:47:34Z,2020-05-27T17:54:29Z,,CLOSED,"Signing service restart script update",2020-08-05T18:47:34Z
developer-experience,caggles,true,2020-06-17T16:32:57Z,2020-05-27T17:58:39Z,,CLOSED,"Artifactory installation automation",2020-06-17T16:32:57Z
developer-experience,ShellyXueHan,true,2020-09-18T17:17:39Z,2020-05-27T18:06:23Z,2020-07-07T00:03:03Z,CLOSED,"Update keycloak pod disruption budget settings",2020-09-18T17:17:39Z
developer-experience,caggles,true,2020-08-27T20:49:27Z,2020-05-27T18:07:09Z,,CLOSED,"Database Report",2020-08-27T20:49:27Z
developer-experience,caggles,true,2020-06-30T23:32:04Z,2020-05-27T18:09:35Z,,CLOSED,"Resource Management Guidelines",2020-06-30T23:32:04Z
developer-experience,caggles,false,,2020-05-27T18:11:41Z,,OPEN,"JFrog Feature Investigation",2020-05-27T18:11:41Z
developer-experience,caggles,true,2020-06-17T16:34:10Z,2020-05-27T18:13:35Z,,CLOSED,"EDB migration preparation",2020-06-17T16:34:10Z
developer-experience,caggles,false,,2020-05-27T18:16:27Z,,OPEN,"edb",2020-05-27T18:16:27Z
developer-experience,caggles,true,2020-05-27T18:17:22Z,2020-05-27T18:16:35Z,,CLOSED,"EDB Keycloak Migration",2020-05-27T18:17:22Z
developer-experience,stewartshea,true,2020-06-18T20:24:39Z,2020-05-28T16:42:05Z,,CLOSED,"Sysdig configuration tuning to fix agent crashes",2020-06-18T20:24:39Z
developer-experience,stewartshea,true,2020-05-28T22:28:36Z,2020-05-28T16:45:09Z,2020-05-28T17:27:22Z,CLOSED,"Reenable sysdig agents in the lab",2020-05-28T22:28:37Z
developer-experience,wmhutchison,true,2020-06-02T18:41:57Z,2020-05-28T19:45:00Z,,CLOSED,"INC0036702 - APP node ociopf-p-208.dmz has degraded SAN storage connectivity",2020-06-02T18:41:57Z
developer-experience,StevenBarre,true,2020-09-17T18:30:36Z,2020-05-28T20:49:11Z,2020-09-17T18:30:02Z,CLOSED,"2020 Q3 Patching schedule",2020-09-17T18:30:37Z
developer-experience,StevenBarre,true,2020-07-02T20:19:20Z,2020-05-29T16:52:31Z,2020-07-02T20:19:06Z,CLOSED,"Provide Project Resource Stats in Product Owner distribution list",2020-07-02T20:19:20Z
developer-experience,StevenBarre,true,2020-06-03T17:10:51Z,2020-05-29T21:45:07Z,,CLOSED,"Remove IPs from hostsubnets",2020-06-03T17:10:52Z
developer-experience,StevenBarre,true,2020-06-10T22:27:28Z,2020-05-29T21:59:33Z,,CLOSED,"INC0036698 MCS - NetApp block provisioning failing due to LUN ID",2020-06-10T22:27:28Z
developer-experience,StevenBarre,true,2020-08-06T20:33:05Z,2020-06-01T21:50:54Z,2020-07-16T20:14:22Z,CLOSED,"INC0036853 Docker Image Registry full- SPIKE",2020-08-06T20:33:05Z
developer-experience,wmhutchison,true,2020-06-03T16:30:18Z,2020-06-02T16:56:58Z,,CLOSED,"INC0036808 - CITZ - PROD MCS - SAN port disabled due to excessive errors for OCIOPF-P-206.DMZ",2020-06-03T16:30:18Z
developer-experience,ShellyXueHan,true,2020-06-17T16:33:51Z,2020-06-03T18:30:13Z,,CLOSED,"Work with app teams to update some incorrect namespace metadata",2020-06-17T16:33:51Z
developer-experience,wmhutchison,true,2020-06-05T22:42:30Z,2020-06-03T23:51:51Z,,CLOSED,"RITM0064320 - PROD MCS - Stability improvements to Metrics Heapster pod",2020-06-05T22:42:30Z
developer-experience,wmhutchison,true,2020-06-10T16:42:04Z,2020-06-04T16:21:55Z,,CLOSED,"RITM0064368 - Internal switch port labelling audit using lldptool",2020-06-10T16:42:04Z
developer-experience,ShellyXueHan,false,,2020-06-04T22:35:24Z,,OPEN,"RocketChat explore MongoDB helm chart",2020-06-04T22:35:35Z
developer-experience,jefkel,true,2021-01-28T18:10:04Z,2020-06-11T01:41:47Z,2020-11-26T21:40:33Z,CLOSED,"Operational tracking of Platform Subscriptions",2021-01-28T18:10:04Z
developer-experience,StevenBarre,true,2020-09-24T17:50:27Z,2020-06-11T16:25:41Z,,CLOSED,"Develop a report for teams to show their CPU / RAM usage",2020-09-24T17:50:27Z
