devops-requests,avkleef,true,2020-06-30T19:45:47Z,2020-06-29T18:24:10Z,,CLOSED,"AG/PSSG BCGOV and BCGov-C Organization Membership Request",2020-07-02T18:30:50Z
devops-requests,kuanfandevops,true,2020-06-30T19:36:41Z,2020-06-29T18:52:51Z,,CLOSED,"EMPR OpenShift Project Set Request - TFRS project ",2020-06-30T19:36:43Z
devops-requests,cboreen,true,2020-06-30T23:24:43Z,2020-06-29T18:55:08Z,,CLOSED,"Access Request for Paul Howells",2020-06-30T23:24:45Z
devops-requests,cboreen,true,2020-06-30T23:25:17Z,2020-06-29T18:58:00Z,,CLOSED,"Access Request for Henry Saldyga",2020-06-30T23:25:18Z
devops-requests,stephenhillier,true,2020-07-10T19:57:53Z,2020-06-29T21:21:24Z,,CLOSED,"User access request",2020-07-10T19:57:55Z
devops-requests,webgismd,true,2020-06-30T19:43:54Z,2020-06-30T16:33:37Z,,CLOSED,"Add another PO to the IITCO Projects",2020-06-30T19:43:56Z
devops-requests,tdekens,true,2020-07-13T18:09:30Z,2020-06-30T20:22:18Z,,CLOSED,"Product Owner for SPI",2020-07-13T18:09:32Z
devops-requests,tdekens,true,2020-07-13T18:11:28Z,2020-06-30T20:47:10Z,,CLOSED,"Product Owner change on BCTW",2020-07-13T18:11:29Z
devops-requests,ShellyXueHan,true,2020-06-30T21:09:31Z,2020-06-30T21:08:27Z,,CLOSED,"test out new message",2020-06-30T21:09:33Z
devops-requests,ActionAnalytics,true,2020-07-06T20:50:40Z,2020-07-02T20:12:05Z,2020-07-02T20:55:41Z,CLOSED,"Add user to BCGov GitHub",2020-07-06T20:50:42Z
devops-requests,avkleef,true,2020-07-09T17:32:40Z,2020-07-03T16:50:19Z,,CLOSED,"AG/PSSG BCGOV and BCGov-C Organization Membership Request",2020-07-09T17:32:43Z
devops-requests,ninosamson,true,2020-07-06T21:00:13Z,2020-07-03T21:26:58Z,2020-07-03T21:27:11Z,CLOSED,"User Access Request: khsekhon",2020-07-06T21:00:16Z
devops-requests,garywong-bc,true,2020-07-07T20:43:41Z,2020-07-06T23:50:11Z,,CLOSED,"Temporary home for BC MSA app (until switch to Open Source and on OpenShift)",2020-07-07T20:43:43Z
devops-requests,avkleef,true,2020-07-09T17:32:54Z,2020-07-08T15:19:50Z,,CLOSED,"AG/PSSG BCGov-C Organization Membership Request",2020-07-09T17:32:56Z
devops-requests,wenzowski,true,2020-07-08T19:00:15Z,2020-07-08T16:32:33Z,,CLOSED,"Request for removing a GitHub App",2020-07-09T16:28:47Z
devops-requests,crigdongov,true,2020-07-13T18:12:45Z,2020-07-08T22:40:07Z,,CLOSED,"Dev OpenShift access for dbc-konga-dev",2020-07-13T18:12:47Z
devops-requests,dtarrybcgov,true,2020-07-13T18:17:21Z,2020-07-09T18:15:25Z,,CLOSED,"Add another product owner to rpjtzt-*",2020-07-13T18:17:22Z
devops-requests,MikeLyttle,true,2020-07-13T18:18:02Z,2020-07-09T22:26:01Z,,CLOSED,"OpenShift Access Request for Mike Scallion",2020-07-13T18:18:04Z
devops-requests,jamesmunro-BCGOV,true,2020-07-13T18:24:19Z,2020-07-10T18:24:16Z,,CLOSED,"Update Product Owner - HETS",2020-07-13T18:24:21Z
devops-requests,jamesmunro-BCGOV,true,2020-07-20T21:24:36Z,2020-07-10T18:25:32Z,,CLOSED,"Update Product Owner - Schoolbus",2020-07-20T21:24:38Z
devops-requests,jamesmunro-BCGOV,true,2020-07-20T21:26:23Z,2020-07-10T18:26:57Z,,CLOSED,"Update Product Owner - Transaction",2020-07-20T21:26:25Z
devops-requests,mitovskaol,true,2020-09-08T20:47:00Z,2020-07-13T16:54:54Z,,CLOSED,"NRM namespaces PO/Tech Lead updated info",2020-09-08T20:50:02Z
devops-requests,MaxWardle,true,2020-07-20T23:30:23Z,2020-07-13T19:03:12Z,,CLOSED,"Request to increase backup storage for new backup strategy.",2020-07-20T23:30:25Z
devops-requests,cmahony,true,2020-08-27T18:36:39Z,2020-07-14T17:33:43Z,,CLOSED,"Colin Mahony",2020-08-27T18:36:41Z
devops-requests,davidpearson99,true,2020-07-17T19:47:11Z,2020-07-14T18:40:24Z,,CLOSED,"Please Add David Pearson (EnterpriseDB)",2020-07-17T19:47:13Z
devops-requests,micheal-w-wells,true,2020-07-16T16:51:53Z,2020-07-15T16:29:22Z,,CLOSED,"OC access for Mike Shasko",2020-07-16T16:51:54Z
devops-requests,poggdogg,true,2020-07-17T17:33:28Z,2020-07-15T19:20:58Z,,CLOSED,"Increase PRIME project maximum PVC Count to 40",2020-07-17T17:33:30Z
devops-requests,yatavin,true,2020-07-16T17:20:02Z,2020-07-15T22:14:50Z,,CLOSED,"New Keycloak Realm for SchoolBus",2020-07-16T17:20:04Z
devops-requests,davidpearson99,true,2020-07-22T16:57:50Z,2020-07-16T14:43:23Z,,CLOSED,"Please provide RDBA Team Access to OpenShift ",2020-07-22T16:57:52Z
devops-requests,jennifer-dowd,true,2020-07-16T16:47:56Z,2020-07-16T16:40:38Z,,CLOSED,"Add user Ayo Ojo back to bcgov-c",2020-07-16T16:56:21Z
devops-requests,rafasbcgov,true,2020-07-21T18:33:17Z,2020-07-17T18:16:55Z,,CLOSED,"Request Keycloak Realm for Business Modernization & Analytics Apps",2020-07-21T18:33:19Z
devops-requests,jsnimmo,true,2020-07-20T21:40:01Z,2020-07-17T18:24:10Z,,CLOSED,"Updating Production Owner and Technical Lead for AGRI-NMP",2020-07-20T21:40:03Z
devops-requests,gil0109,true,2020-07-20T21:40:41Z,2020-07-17T18:30:22Z,2020-07-17T19:05:44Z,CLOSED,"Access to Openshift for Contractor for SBC",2020-07-20T21:40:43Z
devops-requests,avkleef,true,2020-07-27T21:08:54Z,2020-07-22T17:50:58Z,,CLOSED,"AG/PSSG BCGov AND BCGov-C Organization Membership Request",2020-07-27T21:08:56Z
devops-requests,bdolor,true,2020-08-27T19:07:26Z,2020-07-22T21:18:28Z,,CLOSED,"namespaces PO/Tech Lead updated info",2020-08-27T19:07:28Z
devops-requests,crigdongov,true,2020-07-28T00:00:01Z,2020-07-22T22:43:29Z,,CLOSED,"Request to create project space in OCP for APS Team",2020-08-04T21:05:45Z
devops-requests,crigdongov,true,2020-09-11T16:24:05Z,2020-07-22T23:14:27Z,,CLOSED,"Request for realms for APS Team",2020-09-11T16:24:07Z
devops-requests,marklise,true,2020-08-04T18:20:54Z,2020-07-22T23:16:13Z,,CLOSED,"Request for import GitHub repository on SonarCloud",2020-08-04T18:20:57Z
devops-requests,ninosamson,true,2020-07-28T00:05:49Z,2020-07-22T23:17:53Z,2020-07-23T16:00:00Z,CLOSED,"New Project Request - MOH Prescription Management ",2020-07-28T00:05:52Z
devops-requests,lukegonis,true,2020-09-29T17:02:47Z,2020-07-29T17:52:14Z,2020-09-25T22:21:32Z,CLOSED,"Sprint 15 Ops Effort ",2020-09-29T17:02:49Z
devops-requests,jefkel,true,2020-07-31T17:09:39Z,2020-07-31T00:59:47Z,,CLOSED,"bcdevops/OpenShift4-Migration contributor team",2020-07-31T17:09:40Z
devops-requests,avkleef,true,2020-08-27T19:33:49Z,2020-08-04T15:07:53Z,,CLOSED,"AG/PSSG BCGov & BCDevOps Organization Membership Request",2020-08-27T19:33:51Z
devops-requests,jefkel,true,2020-08-11T21:06:06Z,2020-08-04T22:05:21Z,,CLOSED,"OpenShift Access request (Marc LeBlanc)",2020-08-11T21:06:08Z
devops-requests,MikeLyttle,true,2020-08-27T19:16:54Z,2020-08-04T23:15:47Z,,CLOSED,"Gluster Block Quota for bsoszr-*",2020-08-28T06:29:25Z
devops-requests,Sherri-P,true,2020-12-12T01:54:54Z,2020-08-05T14:50:19Z,,CLOSED,"Openshift Projects-Owners & Techleads",2020-12-12T01:54:58Z
devops-requests,avkleef,true,2020-09-04T17:11:52Z,2020-08-05T19:44:21Z,,CLOSED,"AG/PSSG BCGov & BCDevOps Organization Membership Request",2020-09-04T17:12:12Z
devops-requests,gjlawran,true,2020-08-18T17:50:07Z,2020-08-05T21:43:24Z,,CLOSED,"Request to add user to repos",2020-08-18T17:50:10Z
devops-requests,pwei1018,true,2020-08-11T21:00:48Z,2020-08-06T22:02:06Z,,CLOSED,"OpenShift Access request (Melissa Stanton & Amit Chaurasia) openshift-access",2020-08-21T16:24:27Z
devops-requests,var0101,true,2020-08-13T18:20:18Z,2020-08-07T16:37:43Z,,CLOSED,"V. Shankar - Request to join BCGOV GitHub Organization",2020-08-13T18:20:20Z
devops-requests,jefkel,true,2020-08-07T20:37:08Z,2020-08-07T20:12:42Z,2020-08-07T20:45:24Z,CLOSED,"Aaren DeJong (Arctiq) openshift access",2020-09-02T14:42:40Z
devops-requests,ll911,true,2020-08-11T22:47:22Z,2020-08-10T16:55:50Z,,CLOSED,"OpenShift project set access for new member",2020-08-11T22:47:24Z
devops-requests,pwei1018,true,2020-08-11T23:14:25Z,2020-08-10T21:11:45Z,,CLOSED,"OpenShift Access request (Roy Kim) openshift-access",2020-08-11T23:14:28Z
devops-requests,jamesmunro-BCGOV,true,2020-08-13T18:22:33Z,2020-08-11T19:45:10Z,,CLOSED,"Provide access to OpenShift project - HETS for account BCG-B",2020-08-13T18:22:35Z
devops-requests,sidtobias,true,2020-12-03T19:40:15Z,2020-08-12T17:55:11Z,,CLOSED,"Update Backup Quota for BC Wildfire Predictive Services",2020-12-04T23:03:19Z
devops-requests,ninosamson,true,2020-08-13T18:23:35Z,2020-08-13T16:37:14Z,,CLOSED,"Add Health Gateway Developers",2020-08-17T18:21:56Z
devops-requests,ninosamson,true,2020-08-13T18:45:23Z,2020-08-13T16:40:51Z,,CLOSED,"Requesting O/S Access ",2020-08-13T18:45:24Z
devops-requests,rafasbcgov,true,2020-08-25T16:49:43Z,2020-08-17T21:20:20Z,,CLOSED,"OS access request",2020-08-25T16:49:45Z
devops-requests,JEWALKER911,true,2021-01-21T20:40:04Z,2020-08-17T23:38:08Z,,CLOSED,"Change PO for EMBC Emergency Support Services Portal ",2021-01-21T20:40:06Z
devops-requests,avkleef,true,2020-08-25T16:55:29Z,2020-08-18T16:13:28Z,,CLOSED,"AG/PSSG BCGov & BCDevOps Organization Membership Request",2020-08-25T16:55:31Z
devops-requests,Kaineatthelab,true,2020-08-25T16:50:37Z,2020-08-18T16:24:22Z,,CLOSED,"Add new developer for BC Registries - Vysakh Menon - gl2uos-dev",2020-08-25T16:50:39Z
devops-requests,ninosamson,true,2020-08-25T16:51:57Z,2020-08-18T20:00:45Z,,CLOSED,"Add Developer to Health Gateway ",2020-08-31T18:34:48Z
devops-requests,tdekens,true,2020-09-03T16:42:46Z,2020-08-18T20:14:31Z,,CLOSED,"New project - BioHub BC",2020-09-03T16:42:48Z
devops-requests,franTarkenton,true,2020-08-25T17:03:40Z,2020-08-19T22:41:51Z,,CLOSED,"Request for Access for: bruce-tonkin",2020-08-25T18:13:13Z
devops-requests,avkleef,true,2020-08-25T17:04:44Z,2020-08-19T23:34:54Z,,CLOSED,"AG/PSSG BCDevOps Organization Membership Request",2020-08-25T17:04:46Z
devops-requests,micheal-w-wells,true,2020-09-03T16:47:00Z,2020-08-20T17:58:45Z,,CLOSED,"S3 Object Store (for InvasivesBC Photos)",2020-09-03T16:47:02Z
devops-requests,avkleef,true,2020-08-25T17:05:44Z,2020-08-20T18:56:01Z,,CLOSED,"AG/PSSG BCDevOps Organization Membership Request",2020-08-25T17:05:46Z
devops-requests,j-pye,true,2020-08-25T17:00:41Z,2020-08-20T20:10:24Z,2020-08-20T20:11:50Z,CLOSED,"GitOps Private Repo Requests",2020-08-25T17:00:43Z
devops-requests,ll911,true,2020-08-27T19:38:40Z,2020-08-21T20:27:25Z,,CLOSED,"invite new members to bcgov github org for ELMSD-web team",2020-08-27T19:38:41Z
devops-requests,ll911,true,2020-08-27T19:40:05Z,2020-08-21T20:30:52Z,,CLOSED,"grant OpenShift Project set access to new dev",2020-08-27T19:40:07Z
devops-requests,avkleef,true,2020-08-27T19:45:20Z,2020-08-21T21:31:08Z,,CLOSED,"AG/PSSG BCDevOps Organization Membership Request",2020-08-27T19:45:22Z
devops-requests,gjlawran,true,2020-08-27T18:34:18Z,2020-08-25T22:05:42Z,,CLOSED,"Request to become maintainer of https://github.com/orgs/bcgov/teams/databc",2020-08-27T18:34:25Z
devops-requests,arcticweb,true,2020-08-27T19:43:41Z,2020-08-27T04:48:06Z,,CLOSED,"Request for Membership",2020-08-27T19:43:43Z
devops-requests,matthieu-foucault,true,2020-09-03T16:52:06Z,2020-08-27T22:39:47Z,,CLOSED,"CAS Project technical lead email update",2020-09-03T16:52:08Z
devops-requests,akroon3r,true,2020-08-28T22:02:28Z,2020-08-28T18:41:35Z,,CLOSED,"ARO Cluster Request - JAG ISB Splunk Chatops",2020-08-28T22:02:30Z
devops-requests,aideninbcgov,true,2020-09-15T19:56:36Z,2020-08-28T20:34:42Z,,CLOSED,"Access Request",2020-09-15T19:56:38Z
devops-requests,pksmith744,true,2020-08-31T20:00:45Z,2020-08-31T02:44:19Z,,CLOSED,"Request Private Repo #1 for eMHSU Project",2020-08-31T20:00:47Z
devops-requests,pksmith744,true,2020-08-31T20:00:40Z,2020-08-31T02:46:30Z,,CLOSED,"Request Private Repo #2 for eMHSU Project - BCEHS CMS",2020-08-31T20:00:42Z
devops-requests,pksmith744,true,2020-08-31T20:01:03Z,2020-08-31T02:48:02Z,,CLOSED,"Request Private Repo #3  for eMHSU Project - BCEHS Serverless",2020-08-31T20:01:05Z
devops-requests,pksmith744,true,2020-08-31T20:01:25Z,2020-08-31T02:48:57Z,,CLOSED,"Request Private Repo #4 for eMHSU Project - BCEHS iOS",2020-08-31T20:01:27Z
devops-requests,pksmith744,true,2020-08-31T20:01:36Z,2020-08-31T02:50:08Z,,CLOSED,"Request Private Repo #5 for eMHSU Project - BCEHS Android",2020-08-31T20:01:38Z
devops-requests,pksmith744,true,2020-08-31T20:02:01Z,2020-08-31T02:58:01Z,,CLOSED,"Request Private Repo #6 for eMHSU Project - Foundry Provider Web Portal",2020-08-31T20:02:03Z
devops-requests,pksmith744,true,2020-08-31T20:02:21Z,2020-08-31T02:59:01Z,,CLOSED,"Request Private Repo #7 for eMHSU Project - Foundry Serverless",2020-08-31T20:02:22Z
devops-requests,pksmith744,true,2020-08-31T20:02:34Z,2020-08-31T03:00:04Z,,CLOSED,"Request Private Repo #8 for eMHSU Project - Foundry iOS",2020-08-31T20:02:35Z
devops-requests,pksmith744,true,2020-08-31T20:02:53Z,2020-08-31T03:00:45Z,,CLOSED,"Request Private Repo #9 for eMHSU Project - Foundry Android",2020-08-31T20:02:55Z
devops-requests,sumesh-aot,true,2020-09-01T16:39:41Z,2020-08-31T16:10:55Z,,CLOSED,"Request to remove idir user cbowler from Keycloak",2020-09-01T16:39:43Z
devops-requests,mmumby,true,2020-08-31T20:10:18Z,2020-08-31T18:36:54Z,,CLOSED,"Request to remove a duplicate user from KeyCloak",2020-08-31T20:10:20Z
devops-requests,pksmith744,true,2020-09-03T16:54:43Z,2020-09-01T16:42:04Z,2020-09-02T18:22:00Z,CLOSED,"Request for BCGOV GitHub Organization Membership (@bcgov-c)",2020-09-03T16:54:46Z
devops-requests,fwkendall,true,2020-09-03T18:03:32Z,2020-09-01T17:35:17Z,,CLOSED,"Private repo request",2020-09-03T18:03:34Z
devops-requests,fwkendall,true,2020-09-03T18:05:13Z,2020-09-01T17:43:35Z,,CLOSED,"Team member BCGOV org request",2020-09-03T18:05:15Z
devops-requests,fwkendall,true,2020-09-03T18:54:27Z,2020-09-01T17:52:57Z,2020-09-01T22:43:21Z,CLOSED,"New OpenShift project request",2020-09-03T18:54:29Z
devops-requests,fwkendall,true,2020-09-03T18:10:21Z,2020-09-01T17:54:33Z,,CLOSED,"Request for new team member OS access",2020-09-03T18:10:23Z
devops-requests,gil0109,true,2020-09-03T18:11:00Z,2020-09-01T18:16:38Z,,CLOSED,"New Team Member",2020-09-03T18:11:02Z
devops-requests,matthieu-foucault,true,2020-09-03T18:12:15Z,2020-09-01T20:52:01Z,,CLOSED,"Request for BCGOV GitHub Organization Membership (@pbastia)",2020-09-14T17:30:43Z
devops-requests,avkleef,true,2020-09-10T20:10:32Z,2020-09-01T23:02:15Z,,CLOSED,"AG/PSSG BCGov & BCDevOps Organization Membership Request",2020-09-10T20:10:35Z
devops-requests,garywong-bc,true,2020-09-08T20:13:28Z,2020-09-02T20:56:50Z,,CLOSED,"Request for Dev/Test/PROD for agri-nmp-*",2020-09-08T20:13:30Z
devops-requests,jhamidi,true,2020-09-03T22:48:16Z,2020-09-03T17:30:46Z,,CLOSED,"New Team member access for Bryce",2020-09-03T22:48:16Z
devops-requests,jhamidi,true,2020-09-03T22:49:09Z,2020-09-03T17:33:49Z,,CLOSED,"Add Bryce to bcgov githup",2020-09-03T22:49:10Z
devops-requests,sleroy1016,true,2020-09-08T20:35:52Z,2020-09-08T19:34:19Z,,CLOSED,"MOH IAM documize public space",2020-09-08T20:42:26Z
devops-requests,sleroy1016,true,2020-09-10T20:11:34Z,2020-09-08T20:59:00Z,,CLOSED,"MOH IAM integration guide public repo",2020-09-10T20:12:03Z
devops-requests,Maralsotoudehnia,true,2021-01-07T22:32:55Z,2020-09-08T22:41:05Z,,CLOSED,"CAS request for CPU: long running increase",2021-01-07T22:36:26Z
devops-requests,sleroy1016,true,2020-09-15T19:54:29Z,2020-09-09T15:31:10Z,,CLOSED,"bcgov membership for sleroy1016",2020-09-15T22:36:29Z
devops-requests,CITZ-rwk,true,2020-09-15T19:53:01Z,2020-09-09T17:40:51Z,,CLOSED,"requesting aideninbcgov be added to the org",2020-09-15T19:53:03Z
devops-requests,warrenchristian1telus,true,2020-09-15T16:39:12Z,2020-09-09T18:52:51Z,2020-09-11T17:34:55Z,CLOSED,"Moodle",2020-09-15T16:39:14Z
devops-requests,pksmith744,true,2020-09-15T21:44:02Z,2020-09-09T21:58:14Z,,CLOSED,"Access Request to Existing Private Repo (bcgov-c/mhsu-virtual-clinic)",2020-09-15T21:44:04Z
devops-requests,pksmith744,true,2020-09-15T20:01:34Z,2020-09-09T22:01:47Z,,CLOSED,"Request Private Repo for eMHSU Project - MHSU Common DB",2020-09-15T20:01:40Z
devops-requests,pksmith744,true,2020-09-10T20:58:54Z,2020-09-09T22:03:14Z,,CLOSED,"Request Private Repo for eMHSU Project - MHSU Common IDM",2020-09-10T20:58:56Z
devops-requests,matthieu-foucault,true,2020-09-10T20:59:33Z,2020-09-09T23:17:16Z,,CLOSED,"Adding pbastia to wksv3k namespaces",2020-09-10T20:59:36Z
devops-requests,lmullane,true,2020-12-12T01:54:50Z,2020-09-10T17:28:20Z,,CLOSED,"Update BC Registries contacts",2020-12-12T01:54:53Z
devops-requests,avkleef,true,2020-09-21T23:09:52Z,2020-09-14T20:28:36Z,,CLOSED,"AG/PSSG BCGov, BCGov-C & BCDevOps Organization Membership Request",2020-09-21T23:09:54Z
devops-requests,tbaker1313,true,2020-09-15T20:03:14Z,2020-09-14T22:39:42Z,,CLOSED,"Request for new private bcgov-c repo",2020-09-15T20:03:16Z
devops-requests,devinleighsmith,true,2020-09-23T17:18:17Z,2020-09-16T22:21:01Z,2020-09-16T22:22:36Z,CLOSED,"Request new keycloak realms for Sheriff Scheduling project.",2020-09-29T19:09:09Z
devops-requests,marklise,true,2020-09-23T15:48:54Z,2020-09-17T19:11:26Z,,CLOSED,"BCGOV GitHub Org add role request - Neal Li",2020-09-23T15:48:56Z
devops-requests,DonnaHaga,true,2020-10-07T18:43:07Z,2020-09-17T20:22:02Z,,CLOSED,"Request for two private repositories",2020-10-07T18:43:09Z
devops-requests,ninosamson,true,2020-09-23T15:51:37Z,2020-09-18T16:17:51Z,2020-09-18T16:35:05Z,CLOSED,"Request OpenShift Access - Health Gateway Dev ",2020-09-23T15:51:39Z
devops-requests,rstens,true,2020-09-28T20:04:29Z,2020-09-21T17:09:00Z,,CLOSED,"Please add bcgov/invasivesbc to SonarCloud",2020-09-28T20:04:31Z
devops-requests,cvarjao,true,2020-09-21T21:27:17Z,2020-09-21T19:31:02Z,,CLOSED,"Transfer ixhmbm-* namespaces to IIT",2020-09-21T21:27:19Z
devops-requests,dainetrinidad,true,2020-09-28T20:07:02Z,2020-09-21T21:37:56Z,2020-09-21T22:01:43Z,CLOSED,"Request to add gwells to SonarCloud",2020-09-28T20:07:04Z
devops-requests,cvarjao,true,2020-09-25T22:21:13Z,2020-09-21T21:55:12Z,,CLOSED,"Increase PV quota for ixhmbm-prod",2020-09-28T17:04:08Z
devops-requests,dainetrinidad,true,2020-12-12T01:54:48Z,2020-09-21T22:02:54Z,,CLOSED,"Request to add bcgov-c/wally to SonarCloud",2020-12-12T01:54:50Z
devops-requests,Fosol,true,2020-09-23T16:39:23Z,2020-09-23T14:51:40Z,,CLOSED,"Request to add Lawrence Lau to OpenShift",2020-09-23T16:54:17Z
devops-requests,robertedgell,true,2020-09-28T20:24:49Z,2020-09-23T20:06:49Z,,CLOSED,"Please grant OpenShift access to Sreepad K Sreekumaran",2020-09-28T20:24:51Z
devops-requests,tdekens,true,2020-09-28T20:24:05Z,2020-09-23T21:13:37Z,,CLOSED,"OpenShift access",2020-09-28T20:24:07Z
devops-requests,Fosol,true,2020-09-28T20:18:58Z,2020-09-23T22:39:38Z,,CLOSED,"OpenShift Access Request for Bruce Elder",2020-09-28T20:19:00Z
devops-requests,yatavin,true,2020-09-28T20:19:26Z,2020-09-25T17:18:57Z,,CLOSED,"Request for adding OpenShift access",2020-09-28T20:19:28Z
devops-requests,yatavin,true,2020-09-28T20:20:15Z,2020-09-25T17:25:30Z,,CLOSED,"Request for adding OpenShift access",2020-09-28T20:20:17Z
devops-requests,yatavin,true,2020-09-28T20:20:34Z,2020-09-25T17:35:41Z,,CLOSED,"Request for adding OpenShift access",2020-09-28T20:20:36Z
devops-requests,tdekens,true,2020-10-19T16:40:21Z,2020-09-29T22:21:33Z,,CLOSED,"Add OpenShift access - Johnstone",2020-10-19T16:40:24Z
devops-requests,caggles,true,2020-11-17T23:41:55Z,2020-09-30T18:39:25Z,2020-11-17T22:54:44Z,CLOSED,"Sprint 18 Devops Requests Tasks",2020-11-17T23:41:57Z
devops-requests,sheaphillips,true,2020-10-19T21:15:06Z,2020-09-30T23:57:10Z,,CLOSED,"Request for additional Cloud Pathfinder Realms",2020-10-19T21:15:08Z
devops-requests,ychung-mot,true,2020-10-01T17:57:44Z,2020-10-01T17:40:10Z,,CLOSED,"Request to remove IDIR user CMOODY from Keycloak",2020-10-01T17:57:46Z
devops-requests,jhmccoll,true,2020-10-08T18:53:03Z,2020-10-05T20:14:41Z,,CLOSED,"New SBC user requires removal IDIR from Keycloak to permit access to realm vtkayq4c",2020-10-08T18:53:05Z
devops-requests,mtCarto,true,2020-11-03T22:12:40Z,2020-10-06T18:39:28Z,,CLOSED,"setup keycloak realms for esm-dev + esm-test",2020-11-03T22:12:42Z
devops-requests,robertedgell,true,2020-10-15T18:44:58Z,2020-10-07T21:40:49Z,,CLOSED,"Please grant BCGov membership to Sreepad K.",2020-10-15T18:45:00Z
devops-requests,graeme-fw,true,2020-10-15T18:45:22Z,2020-10-07T23:53:03Z,2020-10-08T00:01:04Z,CLOSED,"BCGov Membership Request for Will S.",2020-10-15T18:45:28Z
devops-requests,SpencerRead,true,2020-10-15T18:47:28Z,2020-10-13T18:30:28Z,,CLOSED,"Create new private repo for FoundryBackend",2020-10-15T18:47:31Z
devops-requests,arcshiftsolutions,true,2020-10-15T18:48:20Z,2020-10-13T23:12:52Z,,CLOSED,"Please grant access for Jinil Sung",2020-10-15T18:48:23Z
devops-requests,arcshiftsolutions,true,2020-10-15T18:48:50Z,2020-10-13T23:17:57Z,,CLOSED,"Please grant OpenShift access for Jinil Sung (c2mvws & mvubjx)",2020-10-15T18:48:52Z
devops-requests,Fosol,true,2020-10-15T18:49:26Z,2020-10-14T18:14:14Z,,CLOSED,"Add new team member to BCGov",2020-10-15T18:49:28Z
devops-requests,neilz0r,true,2020-10-19T16:39:04Z,2020-10-14T21:13:28Z,,CLOSED,"remove IDIR kjohns from keycloak for user Kessiah Johnstone",2020-10-19T16:39:07Z
devops-requests,danagerous,true,2020-10-15T18:50:10Z,2020-10-15T17:58:28Z,,CLOSED,"BCGOV Org Membership Request",2020-10-15T18:50:12Z
devops-requests,gil0109,true,2020-12-10T19:56:13Z,2020-10-15T22:48:30Z,,CLOSED,"Issue with Duplicate email address",2020-12-10T19:56:16Z
devops-requests,will-freshworks,true,2020-10-19T23:34:45Z,2020-10-15T22:53:33Z,,CLOSED,"Request for adding or removing OpenShift access",2020-10-19T23:34:47Z
devops-requests,ashtonmeuser,true,2020-10-19T23:39:29Z,2020-10-19T23:37:20Z,,CLOSED,"Request for adding or removing OpenShift access",2020-10-19T23:39:30Z
devops-requests,marklise,true,2020-10-22T18:54:59Z,2020-10-20T20:36:20Z,,CLOSED,"PharmaCare Special Authority Transformation",2020-10-22T18:55:02Z
devops-requests,anissa-agahchen,true,2020-10-21T19:09:23Z,2020-10-21T18:46:26Z,,CLOSED,"remove my IDIR from KeyCloak Realm",2020-10-21T19:09:25Z
devops-requests,rafasbcgov,true,2020-11-03T20:52:16Z,2020-10-22T18:09:14Z,,CLOSED,"Private repo for mobile app",2020-11-03T20:52:18Z
devops-requests,ninosamson,true,2020-11-28T00:36:09Z,2020-10-22T21:33:23Z,,CLOSED,"Remove Project Set - MOH-eRx",2020-11-28T00:36:11Z
devops-requests,will-freshworks,true,2020-11-03T00:35:02Z,2020-10-23T21:43:23Z,,CLOSED,"Realm for Court Interpreter Scheduling",2020-11-03T00:35:14Z
devops-requests,tdekens,true,2020-10-30T16:41:12Z,2020-10-27T21:55:18Z,,CLOSED,"OpenShift access - Devalapurkar",2020-10-30T16:41:14Z
devops-requests,rstens,true,2020-10-30T16:42:30Z,2020-10-28T00:11:03Z,,CLOSED,"Request for BCGOV GitHub Organization Membership: for *multiple* Team members of the BioHubBC Team",2020-10-30T16:42:32Z
devops-requests,rstens,true,2020-10-28T22:57:39Z,2020-10-28T00:19:11Z,,CLOSED,"Request for KeyCloak Realm: BioHubBC",2020-10-28T22:57:41Z
devops-requests,rstens,true,2020-10-30T16:44:10Z,2020-10-28T00:23:02Z,2020-10-28T00:23:28Z,CLOSED,"Request for import GitHub repository on SonarCloud: BioHubBC and BioHubBC-Common-Codes",2020-10-30T16:44:11Z
devops-requests,gil0109,true,2020-11-19T17:26:55Z,2020-10-28T04:47:22Z,,CLOSED,"OCP4 Storage Quote increase e69aae-prod",2020-11-19T17:26:58Z
devops-requests,mitovskaol,true,2020-11-12T18:10:12Z,2020-10-28T18:18:23Z,2020-11-09T23:38:31Z,CLOSED,"SG - Sprint 19 Devops Requests Tickets",2020-11-12T18:10:14Z
devops-requests,mitovskaol,true,2020-11-19T00:28:44Z,2020-10-28T18:28:27Z,2020-11-19T00:28:49Z,CLOSED,"Change Requestron to add new devops-requests to Sprint Goal",2020-11-19T00:28:49Z
devops-requests,arcshiftsolutions,true,2020-10-30T16:46:07Z,2020-10-29T19:28:21Z,,CLOSED,"Please add the PEN Match repo to SonarCloud",2020-10-30T16:46:09Z
devops-requests,will-freshworks,true,2020-10-30T16:47:00Z,2020-10-29T19:45:09Z,,CLOSED,"Request for adding or removing OpenShift access",2020-10-30T16:47:02Z
devops-requests,Pahollan,true,2020-10-30T17:15:12Z,2020-10-30T16:46:15Z,,CLOSED,"OpenShift 4 Namespace request",2020-10-30T17:15:35Z
devops-requests,Pahollan,true,2020-10-30T17:16:39Z,2020-10-30T16:53:57Z,,CLOSED,"OpenShift 4 Namespace requests",2020-10-30T17:16:42Z
devops-requests,Pahollan,true,2020-10-30T17:16:22Z,2020-10-30T17:01:58Z,,CLOSED,"OpenShift 4 Namespace request",2020-10-30T17:16:24Z
devops-requests,Pahollan,true,2020-10-30T17:16:03Z,2020-10-30T17:08:24Z,,CLOSED,"OpenShift 4 Namespace request",2020-10-30T17:16:05Z
devops-requests,tdekens,true,2020-11-03T20:54:52Z,2020-10-30T22:13:08Z,,CLOSED,"OpenShift access - Garrett-Jones",2020-11-03T20:54:54Z
devops-requests,arcshiftsolutions,true,2020-10-30T23:31:50Z,2020-10-30T23:06:18Z,2020-10-30T23:13:28Z,CLOSED,"Please remove Greg Chwelos (gchwelos) from the BCGov & BcDevOps organizations ",2020-10-30T23:31:52Z
devops-requests,gil0109,true,2020-11-19T00:45:05Z,2020-10-31T05:41:04Z,2020-11-14T05:23:51Z,CLOSED,"Storage quota increase for multiple namespaces",2020-11-19T00:45:08Z
devops-requests,marklise,true,2020-11-03T20:54:08Z,2020-11-02T18:36:41Z,,CLOSED,"Request for import GitHub repository on SonarCloud",2020-11-03T20:54:10Z
devops-requests,fresh-rachit,true,2020-11-03T17:13:44Z,2020-11-02T18:38:54Z,,CLOSED,"Health Career Access Program (HCAP): Keycloak Realm Request",2020-11-03T17:13:50Z
devops-requests,StevenBarre,true,2020-11-03T20:55:43Z,2020-11-02T23:01:29Z,,CLOSED,"Clecio needs cluster-reader in SILVER",2020-11-03T20:55:45Z
devops-requests,moragross,true,2020-11-03T20:56:01Z,2020-11-02T23:33:13Z,,CLOSED,"GitHub User Access Request",2020-11-03T20:56:03Z
devops-requests,moragross,true,2020-11-03T20:56:31Z,2020-11-02T23:49:17Z,,CLOSED,"GitHub User Access Request",2020-11-03T20:56:34Z
devops-requests,agahchen,true,2020-11-19T19:07:00Z,2020-11-03T00:20:46Z,,CLOSED,"Request to change quotas for 5115cc-*",2020-11-19T19:07:02Z
devops-requests,WadeBarnes,true,2020-11-19T17:25:57Z,2020-11-03T23:38:32Z,,CLOSED,"Increase quotas for BC Registries Agent OCP4 environments",2020-11-19T17:25:59Z
devops-requests,mitovskaol,true,2020-11-04T17:16:08Z,2020-11-04T17:11:35Z,,CLOSED,"BCGOV GitHub Organization Membership for Christine S",2020-11-04T17:16:12Z
devops-requests,kuanfandevops,true,2020-11-19T00:44:34Z,2020-11-04T19:59:52Z,2020-11-16T20:04:45Z,CLOSED,"Storage quota increase for e52f12-test and e52f12-prod",2020-11-19T00:44:37Z
