Repository,Author,Closed,ClosedAt, CreatedAt, LastEditedAt, State, Title, UpdatedAt
openshift-workshop,kelpisland,false,,2016-02-05T19:30:28Z,,OPEN,"BC Gov - Deploy App",2016-02-05T19:30:28Z
openshift-workshop,kelpisland,false,,2016-02-05T19:30:29Z,,OPEN,"Deploy mongo for ESM app",2016-02-05T19:30:29Z
openshift-workshop,kelpisland,false,,2016-02-05T19:30:31Z,,OPEN,"Install Metrics Component",2016-02-05T19:30:31Z
openshift-workshop,kelpisland,false,,2016-02-05T19:30:32Z,,OPEN,"Secrets",2016-02-05T19:30:32Z
openshift-workshop,kelpisland,false,,2016-02-05T19:30:33Z,,OPEN,"Deploy OS Node on Azure and add to on-prem OS cluster.",2016-02-05T19:30:33Z
openshift-workshop,kelpisland,false,,2016-02-05T19:30:34Z,,OPEN,"Prep executive demo",2016-02-05T19:30:34Z
openshift-workshop,kelpisland,false,,2016-02-05T19:30:35Z,,OPEN,"Github Auth",2016-02-05T19:30:35Z
openshift-workshop,kelpisland,false,,2016-02-05T19:30:36Z,,OPEN,"Explore SDK/API integration with OS",2016-02-05T19:30:36Z
openshift-workshop,kelpisland,false,,2016-02-05T19:30:37Z,,OPEN,"POC Wrap-Up",2016-02-05T19:30:37Z
openshift-workshop,kelpisland,false,,2016-02-05T19:30:38Z,,OPEN,"Remove Alfredo's OS account",2016-02-05T19:30:38Z
openshift-workshop,kelpisland,false,,2016-02-05T19:30:40Z,,OPEN,"OSE Labs",2016-02-05T19:30:40Z
openshift-workshop,kelpisland,false,,2016-02-05T19:30:41Z,,OPEN,"Install wildcard cert for router-based SSL termination",2016-02-05T19:30:41Z
openshift-workshop,kelpisland,false,,2016-02-05T19:30:42Z,,OPEN,"Install certificate chain for wildcard certificate used on console.pathfinder.gov.bc.ca",2016-02-05T19:30:42Z
openshift-workshop,kelpisland,false,,2016-02-05T19:30:43Z,,OPEN,"Project, Pods, Container Quotas",2016-02-05T19:30:43Z
openshift-workshop,kelpisland,false,,2016-02-05T19:30:44Z,,OPEN,"Persistent Volume Claims",2016-02-05T19:30:44Z
openshift-workshop,kelpisland,false,,2016-02-05T19:30:45Z,,OPEN,"Persistent Volume Configuration",2016-02-05T19:30:45Z
openshift-workshop,kelpisland,false,,2016-02-05T19:30:46Z,,OPEN,"Jenkins Deployment Ephemeral",2016-02-05T19:30:46Z
openshift-workshop,kelpisland,false,,2016-02-05T19:30:48Z,,OPEN,"Install wildcard cert for web console",2016-02-05T19:30:48Z
openshift-workshop,kelpisland,false,,2016-02-05T19:30:49Z,,OPEN,"Modify os_default_subdomain too routes are auto-exposed at new-app time",2016-02-05T19:30:49Z
openshift-workshop,kelpisland,false,,2016-02-05T19:30:50Z,,OPEN,"Deploy apps based on source code",2016-02-05T19:30:50Z
openshift-workshop,kelpisland,false,,2016-02-05T19:30:51Z,,OPEN,"Multiple projects and apps",2016-02-05T19:30:51Z
openshift-workshop,kelpisland,false,,2016-02-05T19:30:52Z,,OPEN,"Install OSE 3.1",2016-02-05T19:30:52Z
openshift-workshop,kelpisland,false,,2016-02-05T19:30:53Z,,OPEN,"Change public URL for web console",2016-02-05T19:30:53Z
openshift-workshop,kelpisland,false,,2016-02-05T19:30:54Z,,OPEN,"Deploy apps based on docker images",2016-02-05T19:30:54Z
openshift-workshop,kelpisland,false,,2016-02-05T19:30:56Z,,OPEN,"Deploy apps based on docker files",2016-02-05T19:30:56Z
openshift-workshop,kelpisland,false,,2016-02-05T19:30:57Z,,OPEN,"POC Check List Email",2016-02-05T19:30:57Z
openshift-workshop,kelpisland,false,,2016-02-05T19:30:58Z,,OPEN,"POC Check List - Phone Review",2016-02-05T19:30:58Z
openshift-workshop,kelpisland,false,,2016-02-05T19:30:59Z,,OPEN,"POC Kick Off",2016-02-05T19:30:59Z
openshift-workshop,kelpisland,false,,2016-02-05T19:31:00Z,,OPEN,"OSE Deep Dive",2016-02-05T19:31:00Z
openshift-workshop,kelpisland,false,,2016-02-05T19:31:01Z,,OPEN,"Provide Road Map Trello Card URL",2016-02-05T19:31:01Z
openshift-components,agehlers,true,2018-03-20T21:28:38Z,2018-03-01T23:04:17Z,,CLOSED,"LICENSE File mising",2018-03-20T21:28:38Z
openshift-components,agehlers,true,2018-03-20T21:28:24Z,2018-03-01T23:04:19Z,,CLOSED,"README File mising",2018-03-20T21:28:24Z
openshift-components,agehlers,true,2019-07-12T18:16:40Z,2018-05-25T01:16:02Z,2018-05-25T01:17:39Z,CLOSED,"ZAP Image - Encode html report ",2019-07-12T18:16:40Z
openshift-components,cvarjao,true,2018-07-19T04:09:08Z,2018-07-04T20:35:11Z,2018-07-04T20:36:40Z,CLOSED,"Hardcoded secret name",2018-07-19T04:09:21Z
openshift-components,thorwolpert,true,2019-07-12T18:18:35Z,2018-11-19T22:08:48Z,,CLOSED,"Change Python version from 3.5 to 3.6",2019-07-12T18:18:35Z
openshift-components,patricksimonian,true,2019-01-15T17:17:47Z,2019-01-14T20:26:24Z,,CLOSED,"More descriptive repo description",2019-01-15T17:17:51Z
openshift-components,stewartshea,false,,2019-01-31T01:46:49Z,,OPEN,"Document IPv4 / IPv6 performance impact / config",2019-07-12T18:19:48Z
openshift-components,stewartshea,false,,2019-02-12T21:07:10Z,,OPEN,"document quota structure in wiki and how to find them ",2019-02-12T21:07:10Z
openshift-components,cvarjao,false,,2019-04-15T22:24:16Z,,OPEN,"Jenkins failing handling of pull request closing event",2019-07-12T18:46:28Z
openshift-components,stewartshea,true,2019-04-26T00:21:43Z,2019-04-25T17:49:27Z,,CLOSED,"Aporeto Design Pattern #1",2019-04-26T00:23:35Z
openshift-components,stewartshea,true,2019-04-26T00:21:50Z,2019-04-25T17:50:12Z,,CLOSED,"Aporeto Design Pattern #2",2019-04-26T00:22:52Z
openshift-components,stewartshea,true,2019-04-29T19:50:02Z,2019-04-26T00:22:20Z,,CLOSED,"Aporeto design pattern #1",2019-04-29T19:50:02Z
openshift-components,stewartshea,true,2019-04-29T19:51:12Z,2019-04-26T00:22:31Z,,CLOSED,"Aporeto design pattern 2",2019-04-29T19:51:12Z
openshift-components,patricksimonian,true,2020-11-21T20:47:31Z,2019-06-07T17:09:02Z,,CLOSED,"Jenkins Branch Source Plugin Upgrade 2.5.2 -> 2.5.3",2020-11-21T20:47:32Z
openshift-components,gil0109,false,,2020-04-22T15:44:26Z,,OPEN,"newman recently failing with jenkins-slave-python3nodejs",2020-04-22T15:44:26Z
openshift-components,cvarjao,true,2020-11-21T20:45:00Z,2020-05-07T22:04:23Z,2020-05-07T22:04:37Z,CLOSED,"Jenkins is overwriting symlinks directories",2020-11-21T20:45:00Z
openshift-components,cvarjao,true,2020-11-21T20:43:23Z,2020-08-19T18:47:52Z,2020-08-19T18:48:43Z,CLOSED,"Update Jenkins from 2.176.1 to 2.235.5",2020-11-21T20:43:24Z
openshift-components,cvarjao,false,,2020-11-26T22:14:23Z,,OPEN,"Fine tuning Jenkins",2020-11-26T22:14:23Z
issues-and-solutions,sheaphillips,true,2017-04-23T19:17:50Z,2016-03-03T21:01:37Z,,CLOSED,"How can we restrict visibility of OpenShift-hosted apps to internal (SPAN/Gov) users only?",2017-04-23T19:17:50Z
issues-and-solutions,watkinspd,true,2016-03-08T00:43:03Z,2016-03-07T21:43:08Z,,CLOSED,"Template for Docker strategy build using code sourced from git repo",2016-03-08T01:10:53Z
issues-and-solutions,sheaphillips,true,2019-04-12T16:17:03Z,2016-03-11T17:21:58Z,,CLOSED,"How to rapidly deploy sites protected by SiteMinder when authentication via iDIR and/or BCEID integration is required?",2019-04-12T16:17:04Z
issues-and-solutions,sheaphillips,false,,2016-03-11T17:26:20Z,,OPEN,"Can we provide an shared/common application analytics solution for government apps?",2016-03-15T01:07:09Z
issues-and-solutions,f-w,true,2016-11-16T23:05:21Z,2016-03-14T18:49:22Z,,CLOSED,"S2I build failed at waiting for container",2016-11-16T23:05:21Z
issues-and-solutions,f-w,true,2019-04-12T16:17:52Z,2016-03-15T16:30:18Z,,CLOSED,"pod creation stuck on pending state",2019-04-12T16:17:53Z
issues-and-solutions,sheaphillips,true,2019-04-12T16:15:32Z,2016-03-25T03:13:32Z,,CLOSED,"re-executing build sometimes doesn't pull latest code from github",2019-04-12T16:15:32Z
issues-and-solutions,sheaphillips,false,,2016-03-29T19:22:21Z,,OPEN,"how to do cleanup on docker storage?",2016-05-26T23:28:58Z
issues-and-solutions,sheaphillips,true,2016-03-30T21:52:41Z,2016-03-30T21:41:04Z,,CLOSED,"404's on files I have changed the case on?",2016-03-30T22:00:27Z
issues-and-solutions,f-w,true,2019-04-12T16:14:49Z,2016-04-04T18:39:00Z,,CLOSED,"Update to image stream doesn't trigger deployment",2019-04-12T16:14:50Z
issues-and-solutions,sheaphillips,true,2019-03-27T21:40:55Z,2016-04-13T21:28:49Z,,CLOSED,"Can we support client-initiated websocket connections using the current firewall configuration?",2019-03-27T21:40:55Z
issues-and-solutions,ckayfish,true,2019-04-12T16:07:30Z,2016-06-24T23:10:05Z,,CLOSED,"Access to non-Pathfinder, STMS hosted, databases",2019-04-15T23:07:14Z
issues-and-solutions,ckayfish,true,2019-04-12T16:20:30Z,2016-06-25T03:53:37Z,,CLOSED,"Port Redirects not binding to IPv4 Interface: s2i-aspnet-example failing + workaround",2019-04-12T16:20:30Z
issues-and-solutions,sheaphillips,false,,2016-06-25T14:15:34Z,,OPEN,"What do we need to do to WRT OpenShift routers or other infrastructure where existing reverse proxies are in place?",2019-04-12T16:25:45Z
issues-and-solutions,sheaphillips,true,2019-04-12T16:22:03Z,2016-06-27T18:59:13Z,,CLOSED,"How can we implement source IP restrictions in a framework-y way for OpenShift applications that only want to accept traffic from specific hosts (e.g. SiteMinder RP/LB)?",2019-04-12T16:22:03Z
issues-and-solutions,ll911,true,2019-04-12T16:13:23Z,2016-07-06T18:36:56Z,,CLOSED,"question about private image stream.",2019-04-12T16:13:23Z
issues-and-solutions,GregTurner,true,2017-08-14T22:05:17Z,2016-10-06T16:38:35Z,,CLOSED,"Unknown network latency/timeouts under medium loads",2017-08-14T22:05:18Z
issues-and-solutions,erichjna,true,2019-04-12T16:23:00Z,2016-12-15T15:55:12Z,,CLOSED,"Pods get killed and no events log to investigate",2019-04-12T16:23:06Z
illr,ll911,true,2016-06-02T17:19:37Z,2016-06-02T17:19:34Z,,CLOSED,"add geocodered data",2016-06-02T17:19:37Z
shiftbot,sheaphillips,false,,2016-11-01T21:22:39Z,,OPEN,"Ability to explore/inquire about BC gov GitHub repos from chat client ",2016-11-01T21:22:39Z
shiftbot,sheaphillips,false,,2016-11-01T21:23:12Z,,OPEN,"Ability to provision new (compliant) BC Gov open source repo via chat client",2016-11-01T21:23:12Z
shiftbot,sheaphillips,false,,2016-11-01T21:24:14Z,,OPEN,"Ability to check a repo for open source policy compliance via chat client",2016-11-01T21:24:14Z
openshift-tools,stewartshea,true,2020-01-23T20:04:38Z,2017-08-16T18:30:46Z,,CLOSED,"improve infrastructure checking in reboot playbook",2020-01-23T20:04:38Z
openshift-tools,hawthose,true,2018-06-25T16:31:48Z,2017-08-31T18:45:30Z,2017-08-31T18:49:06Z,CLOSED,"race condition",2018-06-25T16:31:48Z
openshift-tools,StevenBarre,true,2020-01-23T19:55:33Z,2018-06-25T16:34:08Z,,CLOSED,"Gluster disk check may alert unnessisarily",2020-01-23T19:55:33Z
openshift-tools,stewartshea,true,2020-01-23T19:48:46Z,2018-07-27T15:16:41Z,,CLOSED,"Hardcoded router count causes manual updates to the playbook",2020-01-23T19:48:46Z
openshift-tools,sheaphillips,true,2019-02-20T21:49:42Z,2019-02-07T18:56:39Z,,CLOSED,"Update instructions on confirmation page",2019-02-20T21:49:42Z
openshift-tools,sheaphillips,true,2019-02-20T21:49:40Z,2019-02-07T19:01:53Z,,CLOSED,"Going through 'Update Registration Profile' flow after registering, prior to confirming email skips to 'thank you' and does not show profile info.",2019-02-20T21:49:40Z
openshift-tools,sheaphillips,true,2019-03-12T20:48:44Z,2019-02-07T19:02:21Z,,CLOSED,"Do we want the 'end user' name to be 'Reggie'?",2019-03-12T20:48:44Z
openshift-tools,sheaphillips,true,2019-02-20T21:49:47Z,2019-02-07T19:54:23Z,,CLOSED,"Review email template/content",2019-02-20T21:49:47Z
openshift-tools,sheaphillips,true,2019-02-20T21:49:41Z,2019-02-07T20:31:59Z,,CLOSED,"Layout - do we want login/logout buttons in header when this is a login app?",2019-02-20T21:49:41Z
openshift-tools,sheaphillips,true,2019-02-20T21:49:43Z,2019-02-07T20:47:02Z,,CLOSED,"'Welcome' message should use Firstname as provided in profile form.",2019-02-20T21:49:43Z
openshift-tools,sheaphillips,true,2019-02-20T21:49:44Z,2019-02-07T20:48:19Z,,CLOSED,"Need additional descriptive text on screen with 'Go to RocketChat' and 'Invite New User'",2019-02-20T21:49:44Z
openshift-tools,sheaphillips,true,2019-02-08T00:21:54Z,2019-02-07T20:59:17Z,,CLOSED,"Logout does not seem to work...",2019-02-08T00:21:54Z
openshift-tools,sheaphillips,true,2019-02-08T00:42:34Z,2019-02-07T21:02:54Z,,CLOSED,"Email address not passed through from GitHub auth in registration flow?",2019-02-08T00:42:34Z
openshift-tools,sheaphillips,true,2019-02-20T21:49:37Z,2019-02-11T18:29:20Z,,CLOSED,"Include link in message to 'repeat the registration process'.",2019-02-20T21:49:37Z
openshift-tools,sheaphillips,true,2019-07-12T18:37:49Z,2019-02-28T19:44:17Z,,CLOSED,"Add 'product_owner' metadata to project space creation script/process",2019-07-12T18:37:50Z
openshift-tools,ShellyXueHan,true,2019-03-13T16:37:44Z,2019-03-04T20:20:48Z,,CLOSED,"Quota template outdated",2019-03-13T16:37:44Z
openshift-tools,ShellyXueHan,true,2019-04-25T22:06:36Z,2019-04-25T22:06:06Z,,CLOSED,"Investigate into Terraform KeyCloak provider",2019-04-25T22:06:36Z
openshift-tools,caggles,true,2019-10-28T22:48:27Z,2019-10-23T18:02:09Z,,CLOSED,"Update OpenShift Project Labels to include PO and PL rocket-chat contact information.",2019-10-28T22:48:27Z
openshift-tools,mitovskaol,false,,2020-03-24T23:03:32Z,,OPEN,"Display source repo info for GitHub-sourced pages in DevHub",2020-03-24T23:03:32Z
openshift-tools,mitovskaol,false,,2020-04-28T18:19:16Z,,OPEN,"Add BCDevExchange Logo and Banner to the new Status Page",2020-04-28T18:19:16Z
openshift-tools,mitovskaol,true,2020-07-29T17:53:15Z,2020-06-17T16:57:20Z,,CLOSED,"Update Resource Tuning Guidelines",2020-07-29T17:53:15Z
openshift-tools,mitovskaol,false,,2020-07-29T18:26:55Z,,OPEN,"Update SysDig Platform Capacity Dashboard with more info",2020-07-29T18:27:13Z
openshift-tools,mitovskaol,true,2020-10-26T16:39:36Z,2020-09-23T19:05:30Z,2020-10-01T20:48:38Z,CLOSED,"Apply SRE principles to build a reliable Platform Service",2020-10-26T16:39:36Z
openshift-tools,mitovskaol,false,,2020-10-01T16:24:13Z,,OPEN,"Cleaning up inactive users in RocketChat",2020-10-01T16:24:14Z
openshift-tools,mitovskaol,false,,2020-10-05T20:27:22Z,,OPEN,"Inactive user pruning in RocketChat",2020-10-05T20:28:07Z
openshift-tools,mitovskaol,true,2020-10-14T16:59:39Z,2020-10-08T17:54:19Z,,CLOSED,"Project Registry Front end Wording tweaks",2020-10-14T16:59:39Z
BCDevOps-Guide,garywong-bc,false,,2018-04-18T01:54:09Z,,OPEN,"Incomplete sentence?",2018-04-18T01:54:09Z
s2i-caddy,agehlers,true,2018-03-10T03:37:42Z,2018-03-01T23:04:56Z,,CLOSED,"LICENSE File mising",2018-03-10T03:37:42Z
s2i-caddy,cvarjao,false,,2019-04-13T06:41:13Z,2019-04-13T06:52:57Z,OPEN,"Make this image more compatible with other s2i images",2019-04-13T06:52:57Z
s2i-caddy,ytqsl,false,,2020-04-02T21:15:43Z,,OPEN,"Upgrade to Caddy v1",2020-04-02T21:15:43Z
openshift-wiki,cvarjao,true,2018-02-16T22:57:19Z,2018-02-16T17:18:24Z,,CLOSED,"How-to: Crete a self-signed certificate",2018-02-16T22:57:24Z
openshift-wiki,cvarjao,true,2018-02-16T22:56:57Z,2018-02-16T17:20:36Z,,CLOSED,"How-to: Generate a Certificate Signing Request (CSR)",2018-02-16T22:56:57Z
openshift-wiki,StevenBarre,true,2019-05-27T18:38:52Z,2018-10-19T17:43:05Z,,CLOSED,"Best practices for CronJobs",2019-05-27T18:38:52Z
openshift-wiki,ShellyXueHan,true,2019-03-07T18:08:06Z,2019-02-28T00:37:24Z,,CLOSED,"Update request template content",2019-03-07T18:08:06Z
openshift-wiki,ShellyXueHan,true,2019-03-07T18:08:47Z,2019-02-28T00:38:41Z,,CLOSED,"Track history of requests in slack channel",2019-03-07T18:08:47Z
openshift-wiki,kelpisland,true,2019-03-27T21:37:17Z,2019-03-25T15:04:31Z,,CLOSED,"Devhub Issue: How to request a new OpenShift project. Link to Slack#requests needs to be updated",2019-03-27T21:37:17Z
openshift-wiki,ShellyXueHan,true,2019-03-26T19:55:23Z,2019-03-25T16:15:57Z,,CLOSED,"Request wiki pages have outdated slack link",2019-03-26T19:55:24Z
openshift-wiki,kelpisland,true,2019-03-27T21:36:30Z,2019-03-26T19:21:13Z,,CLOSED,"Devhub Issue: How to request new user access to OpenShift change slack links to rocket chat",2019-03-27T21:36:30Z
openshift-wiki,kelpisland,true,2019-03-27T21:31:59Z,2019-03-26T19:55:32Z,,CLOSED,"Devhub Issue: SSO Realm Creation Slack...",2019-03-27T21:31:59Z
openshift-wiki,ShellyXueHan,true,2019-10-23T18:42:27Z,2019-04-10T18:27:12Z,,CLOSED,"Request template for GitHub access",2019-10-23T18:42:27Z
openshift-wiki,jleach,true,2019-05-01T23:29:47Z,2019-04-29T22:22:48Z,,CLOSED,"Service definition for SSO",2019-05-01T23:29:47Z
openshift-wiki,patricksimonian,false,,2019-09-20T18:10:09Z,,OPEN,"Devhub Issue: OpenShift Networking - Pathfinder Project Config - Out of date",2020-01-03T22:56:59Z
openshift-wiki,tosazuwa,true,2019-10-23T18:41:31Z,2019-10-08T23:32:45Z,,CLOSED,"Devhub Issue: How to request new GitHub user access or repository creation [short description here]",2019-10-23T18:41:31Z
openshift-wiki,tosazuwa,true,2019-10-23T18:43:09Z,2019-10-08T23:34:25Z,,CLOSED,"Devhub Issue: How to request new GitHub user access or repository creation [short description here]",2019-10-23T18:43:09Z
openshift-wiki,ShellyXueHan,true,2019-10-23T21:12:39Z,2019-10-23T18:05:30Z,,CLOSED,"Devhub Issue: Requesting a SSO Realm to be created [short description here]",2019-10-23T21:12:39Z
openshift-wiki,ShellyXueHan,true,2019-10-23T21:12:37Z,2019-10-23T18:06:14Z,,CLOSED,"Devhub Issue: How to Request a New OpenShift Project [short description here]",2019-10-23T21:12:37Z
openshift-wiki,ShellyXueHan,true,2019-11-01T23:12:11Z,2019-10-31T19:30:16Z,,CLOSED,"Update kc sso BCSC info",2019-11-01T23:12:11Z
openshift-wiki,csherman-gov,true,2020-01-03T22:17:19Z,2019-12-16T17:33:08Z,,CLOSED,"Devhub Issue: How to Request New User Access to OpenShift [qjtfov]",2020-01-03T22:17:19Z
openshift-wiki,vonfoovonbar,true,2020-01-03T22:20:41Z,2019-12-18T23:36:22Z,,CLOSED,"Devhub Issue: BC Government SSO Service Definition [short description here]",2020-01-03T22:20:41Z
openshift-wiki,KADAMEC,true,2020-03-23T17:17:11Z,2020-01-30T18:46:05Z,,CLOSED,"Devhub Issue: Requesting a SSO Realm to be created for and agile tool being developed called GLADIS.  Requested by Kimberly Adamec kimberly.adamec@gov.bc.ca",2020-03-23T17:17:11Z
openshift-wiki,kelpisland,true,2020-03-23T17:18:19Z,2020-01-31T23:11:10Z,,CLOSED,"Devhub Issue: BC Government SSO Service Definition [short description here]",2020-03-23T17:18:19Z
openshift-wiki,patricksimonian,false,,2020-02-05T18:49:47Z,,OPEN,"Devhub Issue: Persistent Storage Services (add tags to frontmatter)",2020-02-05T18:49:47Z
openshift-wiki,patricksimonian,false,,2020-02-10T21:07:27Z,,OPEN,"Devhub Issue: Persistent Storage Services, clearer  guidance needed on using netapp",2020-03-25T16:32:01Z
openshift-wiki,patricksimonian,true,2020-03-30T22:25:41Z,2020-02-20T17:50:11Z,,CLOSED,"Devhub Issue: Persistent Storage Services:  no Netapp docs",2020-03-30T22:25:41Z
openshift-wiki,patricksimonian,true,2020-03-23T22:31:35Z,2020-03-09T17:51:19Z,,CLOSED,"Devhub Issue: Requesting a SSO Realm to be created [add tags]",2020-03-23T22:31:35Z
openshift-wiki,kelpisland,true,2020-03-23T22:31:25Z,2020-03-09T20:14:39Z,,CLOSED,"Devhub Issue: BC Government SSO Service Definition [Corporate PIA complete]",2020-03-23T22:31:25Z
openshift-wiki,victorchong,false,,2020-03-24T23:01:43Z,,OPEN,"Devhub Issue: How to request new GitHub user access or repository creation [short description here]",2020-03-24T23:01:43Z
openshift-wiki,jleach,false,,2020-09-22T19:28:01Z,,OPEN,"Devhub Issue: BC Gov OpenShift networking overview needs OCP4 updates.",2020-09-22T19:28:01Z
openshift-wiki,zhsu,false,,2020-11-16T23:29:32Z,,OPEN,"Devhub Issue: Requesting a SSO Realm to be created ",2020-11-16T23:32:43Z
openshift-wiki,ll911,false,,2020-12-15T01:24:35Z,,OPEN,"Devhub Issue: Requesting a SSO Realm to be created [short description here]",2020-12-15T01:24:35Z
openshift-wiki,patricksimonian,false,,2020-12-18T19:03:05Z,,OPEN,"Devhub Issue: BC Government SSO Service Definition ",2020-12-18T19:03:05Z
openshift-wiki,joburgar,false,,2021-02-17T17:51:48Z,,OPEN,"Devhub Issue: How to request new GitHub user access andrepository creation",2021-02-17T17:51:48Z
openshift-wiki,lmullane,false,,2021-04-20T21:00:27Z,2021-04-20T21:00:54Z,OPEN,"Devhub Issue: How to request new GitHub users accss",2021-04-20T21:00:54Z
openshift-developer-tools,asanchezr,true,2018-10-24T22:17:48Z,2018-10-24T17:31:08Z,,CLOSED,"Parameter file generation should support values with white-space",2018-10-24T22:17:48Z
openshift-developer-tools,esune,false,,2021-02-02T19:07:14Z,,OPEN,"Always load default profile parameters BEFORE profile-specific parameters",2021-02-02T21:30:43Z
minio-openshift,garywong-bc,false,,2018-04-03T23:31:33Z,,OPEN,"IP Whitelisting?",2018-04-03T23:31:33Z
minio-openshift,gil0109,false,,2020-03-20T01:10:50Z,,OPEN,"Is this a HA instance?",2020-03-20T01:10:50Z
minio-openshift,thegentlemanphysicist,false,,2021-02-22T03:39:05Z,,OPEN,"Has this been moved over to OCP 4?",2021-02-22T03:39:05Z
BDDStack,rstens,false,,2017-12-13T20:25:50Z,,OPEN,"Selection of Item in dropdown box fails in Safari",2017-12-13T20:25:50Z
BDDStack,GuopingJia,true,2018-09-21T07:50:10Z,2018-08-23T15:41:45Z,,CLOSED,"Firefox headless in GebConfig does not work",2018-09-21T07:50:10Z
innovation-lab-projects,agehlers,false,,2018-01-13T00:17:40Z,2018-01-13T01:48:04Z,OPEN,"csnr-devops-lab",2018-01-13T01:48:03Z
innovation-lab-projects,agehlers,false,,2018-01-13T00:24:00Z,2018-01-13T01:47:48Z,OPEN,"ag-devops-lab",2018-01-13T01:47:37Z
innovation-lab-projects,agehlers,false,,2018-01-13T01:43:10Z,2018-01-13T01:50:13Z,OPEN,"agri-nmp",2018-01-13T01:50:12Z
sonarqube,agehlers,true,2018-10-24T14:37:38Z,2018-03-01T23:05:22Z,,CLOSED,"LICENSE File mising",2018-10-24T14:37:38Z
sonarqube,WadeBarnes,false,,2018-11-09T18:53:34Z,,OPEN,"Add additional documentation regarding available jenkins slave images for Sonar scanning",2018-11-13T16:22:39Z
sonarqube,gil0109,false,,2018-11-16T03:13:10Z,,OPEN,"Missing plugins when upgrading Sonarqube Versions",2019-07-29T12:57:12Z
sonarqube,WadeBarnes,true,2019-12-02T21:36:23Z,2019-07-29T12:56:29Z,,CLOSED,"Upgrade to SonarQube 7.9",2019-12-02T21:36:24Z
sonarqube,WadeBarnes,false,,2019-09-05T13:59:52Z,,OPEN,"Document how to use SonarCloud in place of the self hosted SonarQube Server image",2020-03-23T19:15:50Z
sonarqube,WadeBarnes,false,,2019-12-02T21:38:49Z,,OPEN,"Zap Summary Report not showing up in SoranQube 7.9.1",2019-12-21T00:00:27Z
sonarqube,rstens,false,,2020-01-11T00:03:06Z,,OPEN,"jenkins-python3nodejs needs to be updated to support node >= 8",2020-01-11T00:03:21Z
sonarqube,WadeBarnes,true,2020-01-16T17:03:39Z,2020-01-16T15:24:47Z,,CLOSED,"zap-pipeline fails on 'Publish ZAP Report to SonarQube ...' step",2020-01-16T17:03:39Z
sonarqube,emuthiah,true,2020-04-17T00:17:13Z,2020-04-16T17:15:49Z,,CLOSED,"Sonarqube: force authentication",2020-04-17T00:17:13Z
sonarqube,ShellyXueHan,false,,2020-04-30T19:08:24Z,,OPEN,"Share your experience on the integration of SonarCube and SonarCloud",2020-06-04T20:14:14Z
sonarqube,devinleighsmith,false,,2020-09-22T21:17:49Z,,OPEN,"The update to sonarqube 8.4.2 has broken the zap-sonar-plugin",2020-11-28T21:04:28Z
sonarqube,esune,false,,2020-12-23T23:27:00Z,2020-12-23T23:28:26Z,OPEN,"Implement network security policies",2020-12-23T23:28:26Z
jenkins-pipeline-shared-lib,DerekRoberts,true,2021-02-11T20:17:18Z,2018-05-31T19:20:36Z,,CLOSED,"GitHubHelper.groovy - add branch protection support",2021-02-11T20:17:18Z
jenkins-pipeline-shared-lib,jujaga,false,,2020-11-24T00:34:13Z,2020-11-24T00:39:47Z,OPEN,"GitHubHelper.createDeploymentStatus no longer works",2020-11-24T00:39:47Z
certbot,cvarjao,false,,2019-02-07T03:22:08Z,,OPEN,"Add support to endorsed certificate issuer: Entrust",2019-02-07T03:23:25Z
certbot,cvarjao,false,,2019-06-18T21:29:28Z,,OPEN,"Make it compatible with cert-manager",2019-06-18T21:29:28Z
certbot,RajvirBains,true,2020-08-28T17:01:00Z,2020-08-11T21:17:20Z,,CLOSED,"No package certbot-1.3.0-1.el7 available",2020-08-28T17:01:00Z
certbot,cvarjao,false,,2020-12-18T21:52:52Z,,OPEN,"grouping requests certs",2021-03-19T19:42:26Z
certbot,cvarjao,true,2021-02-11T18:48:08Z,2020-12-21T19:27:20Z,,CLOSED,"UBI based image and support to OCP4",2021-02-11T18:48:08Z
certbot,bish0polis,false,,2021-03-10T07:39:24Z,,OPEN,"https://github.com/BCDevOps/certbot/blob/master/docker/Dockerfile#L23 is a little specific",2021-03-18T01:16:43Z
ocp-cd-pipeline,patricksimonian,false,,2019-02-26T17:54:13Z,,OPEN,"Jenkins Runs out of Space",2019-02-26T17:54:13Z
ocp-cd-pipeline,patricksimonian,false,,2019-03-25T16:17:46Z,,OPEN,"Question: Where does the bcgov class come from within the pipeline?",2019-05-14T22:04:59Z
keycloak-admin,ShellyXueHan,true,2019-03-20T23:44:14Z,2019-03-07T19:49:11Z,,CLOSED,"Username contains \ which keycloak doesn't support",2019-03-20T23:44:14Z
keycloak-admin,caggles,true,2019-10-04T19:54:40Z,2019-09-27T19:08:25Z,,CLOSED,"Create Initial Artifactory Docs",2019-10-04T19:54:40Z
keycloak-admin,ShellyXueHan,false,,2019-12-02T22:09:13Z,2019-12-02T23:16:46Z,OPEN,"Keycloak api 400 Bad Request",2019-12-02T23:16:46Z
keycloak-admin,patricksimonian,false,,2019-12-23T18:03:44Z,,OPEN,"Short-lived realm admin ",2019-12-23T18:03:44Z
keycloak-admin,ShellyXueHan,false,,2020-12-31T00:13:24Z,,OPEN,"k6 custom usage output config as file",2020-12-31T00:13:24Z
backup-container,WadeBarnes,true,2018-11-13T18:24:25Z,2018-11-13T17:28:05Z,,CLOSED,"Add duration to output of restore operation",2018-11-13T18:24:25Z
backup-container,WadeBarnes,false,,2018-11-13T19:18:35Z,,OPEN,"Speed up database restores",2019-03-14T20:06:43Z
backup-container,WadeBarnes,false,,2019-01-18T15:48:55Z,2019-01-18T15:52:28Z,OPEN,"Align Cronjob and Pod configurations",2019-01-18T15:52:28Z
backup-container,jefkel,false,,2019-03-14T23:18:49Z,,OPEN,"Externalize validation database",2019-03-18T16:26:06Z
backup-container,WadeBarnes,false,,2019-04-03T14:04:19Z,,OPEN,"Webhook notification when server fails to start in timely manner is not clear",2019-09-12T14:16:12Z
backup-container,DerekRoberts,true,2020-03-23T12:49:21Z,2019-04-03T16:58:06Z,,CLOSED,"Verify Troubles with PostGIS",2020-03-23T12:49:21Z
backup-container,WadeBarnes,false,,2019-04-11T13:36:54Z,,OPEN,"Add database size comparison to verification tests",2019-07-29T18:01:58Z
